FECHA CREACIÓN;No. REQUERIMIENTO;DESCRIPCION REQUERIMIENTO ;APLICACIÓN;MÓDULO;GERENCIA;AREA;USUARIO;EMPRESA CONSULTORA;CONSULTOR;ESTADO REQUERIMIENTOS;FECHA ASIGNACIÓN;FECHA ESTIMADA DE ENTREGA;FECHA DE CIERRE;OBSERVACION
16/05/2014;6000000000;TEST DE NUEVO SERV DESK EN 7.1;SAP;FI-AA;PROYECTO NIIF;PROYECTO NIIF;;;;CERRADO;;;;
16/05/2014;6000000001;TEST DE NUEVO SERV DESK EN 7.1;;BC-ABA;PROYECTO NIIF;PROYECTO NIIF;;;;CERRADO;;;;
16/05/2014;6000000002;PRUEBA- TEST CON ERROR;;BC-ABA;PROYECTO NIIF;PROYECTO NIIF;;;;CERRADO;;;;
16/05/2014;6000000003;PRUEBA- TEST CON ERROR 2;;SD-IS;PROYECTO NIIF;PROYECTO NIIF;;;;CERRADO;;;;
16/05/2014;6000000004;PRUEBA-TEST;;BC-ABA;PROYECTO NIIF;PROYECTO NIIF;;;;CERRADO;;;;
22/05/2014;6000000010;NO VISUALIZA DOC.FI EN TRANSACCIÓN MIGO;SAP;MM-IS;PROYECTO NIIF;PROYECTO NIIF;;;;CERRADO;;;;
22/05/2014;6000000011;NO VISUALIZA DOC.FI EN TRANSACCIÓN MIRO;SAP;MM-IS;PROYECTO NIIF;PROYECTO NIIF;;;;CERRADO;;;;
22/05/2014;6000000012;CREACION DE DOCUMENTOS DE PICKING;;SD-IS;PROYECTO NIIF;PROYECTO NIIF;;;;CERRADO;;;;
22/05/2014;6000000013;NO VISUALIZA DOC.FI EN TRANSACCIÓN MB02;SAP;MM-IS;PROYECTO NIIF;PROYECTO NIIF;;;;CERRADO;;;;
22/05/2014;6000000014;TRANSACCIÓN MB1A OBSOLETA;SAP;MM-IS;PROYECTO NIIF;PROYECTO NIIF;;;;CERRADO;;;;
22/05/2014;6000000015;TRANSACCIÓN MB1B OBSOLETA;SAP;MM-IS;PROYECTO NIIF;PROYECTO NIIF;;;;CERRADO;;;;
22/05/2014;6000000016;TRANSACCIÓN MB1C OBSOLETA;SAP;MM-IS;PROYECTO NIIF;PROYECTO NIIF;;;;CERRADO;;;;
22/05/2014;6000000017;NO VISUALIZA DOC.FI EN TRANSACCIÓN MIGO;SAP;MM-IS;PROYECTO NIIF;PROYECTO NIIF;;;;CERRADO;;;;
22/05/2014;6000000018;NO PERMITE GENERAR TRANSACCIÓN ZPAGOS_TR;;TR-TM;PROYECTO NIIF;PROYECTO NIIF;;;;CERRADO;;;;
23/05/2014;6000000020;TRANSACCION OBSOLETA;;SD-IS;PROYECTO NIIF;PROYECTO NIIF;;;;CERRADO;;;;
23/05/2014;6000000021;ERROR DOCUMENTOS FINANCIEROS;;SD-IS;PROYECTO NIIF;PROYECTO NIIF;;;;CERRADO;;;;
23/05/2014;6000000022;NO PERMITE ACCESO TRANSACCION FB03;SAP;FI-GL;PROYECTO NIIF;PROYECTO NIIF;;;;CERRADO;;;;
23/05/2014;6000000023;ERROR DESPRENDIBLE DE NOMINA;;PY-CO;PROYECTO NIIF;PROYECTO NIIF;;;;CERRADO;;;;
23/05/2014;6000000024;CONTABILIZACION DE SALIDAS DE MERCANCIA;;SD-IS;PROYECTO NIIF;PROYECTO NIIF;;;;CERRADO;;;;
24/05/2014;6000000025;CONFIGURACIÓN IMPRESORAS TESORERÍA;;TR-TM;PROYECTO NIIF;PROYECTO NIIF;;;;CERRADO;;;;
24/05/2014;6000000026;CONFIGURACIÓN IMPRESORAS TESORERÍA;;TR-TM;PROYECTO NIIF;PROYECTO NIIF;;;;CERRADO;;;;
24/05/2014;6000000027;GRUPO DE OPERACIONES NO ACTUALIZADAS;;CO-OM;PROYECTO NIIF;PROYECTO NIIF;;;;CERRADO;;;;
24/05/2014;6000000028;GRUPO DE OPERACIONES NO ACTUALIZADAS;;CO-OM;PROYECTO NIIF;PROYECTO NIIF;;;;CERRADO;;;;
24/05/2014;6000000029;GRUPO DE OPERACIONES NO ACTUALIZADAS;;CO-OM;PROYECTO NIIF;PROYECTO NIIF;;;;CERRADO;;;;
24/05/2014;6000000030;GRUPO DE OPERACIONES NO ACTUALIZADAS;;CO-OM;PROYECTO NIIF;PROYECTO NIIF;;;;CERRADO;;;;
24/05/2014;6000000031;TIEMPO DE RESPUESTA DEMORADO;;CO-OM;PROYECTO NIIF;PROYECTO NIIF;;;;CERRADO;;;;
24/05/2014;6000000032;DB20 (CHECK DB);;BC-ABA;PROYECTO NIIF;PROYECTO NIIF;;;;CERRADO;;;;
24/05/2014;6000000033;RZ10 OBSOLETA;;BC-ABA;PROYECTO NIIF;PROYECTO NIIF;;;;CERRADO;;;;
24/05/2014;6000000034;S_BCE_68001439 REPORTE OBSOLETO;;BC-ABA;PROYECTO NIIF;PROYECTO NIIF;;;;CERRADO;;;;
26/05/2014;6000000040;CARGUE MASIVO PSPTO EN CEBES;;CO-OM;PROYECTO NIIF;PROYECTO NIIF;;;;CERRADO;;;;
26/05/2014;6000000041;SCOT CONFIGURACION DIFERENTE;;BC-ABA;PROYECTO NIIF;PROYECTO NIIF;;;;CERRADO;;;;
27/05/2014;6000000042;NO PERMITE CREAR EL MATERIAL;SAP;MM-IS;PROYECTO NIIF;PROYECTO NIIF;;;;CERRADO;;;;
28/05/2014;6000000043;ERROR EN MAESTRO DEUDORES - CLIENTES;;SD-IS;PROYECTO NIIF;PROYECTO NIIF;;;;CERRADO;;;;
28/05/2014;6000000044;DEMANDA CAMPOS DE LA FUNCIÓN DE TEXTILES;SAP;MM-IS;PROYECTO NIIF;PROYECTO NIIF;;;;CERRADO;;;;
28/05/2014;6000000045;ERROR AL CONTABILIZAR SALIDA MERCANCIAS;;SD-IS;PROYECTO NIIF;PROYECTO NIIF;;;;CERRADO;;;;
28/05/2014;6000000046;SSAA NO EJECUTA NINGUNA TAREA;;BC-ABA;PROYECTO NIIF;PROYECTO NIIF;;;;CERRADO;;;;
29/05/2014;6000000047;PROGRAMA ZCDSDEV055 CANCELA;;BC-ABA;PROYECTO NIIF;PROYECTO NIIF;;;;CERRADO;;;;
29/05/2014;6000000048;NO PERMITE MODIFICARR EL MATERIAL;SAP;MM-IS;PROYECTO NIIF;PROYECTO NIIF;;;;CERRADO;;;;
29/05/2014;6000000049;ST06 CONFIGURACION DIFERENTE;;BC-ABA;PROYECTO NIIF;PROYECTO NIIF;;;;CERRADO;;;;
29/05/2014;6000000050;STMS. TRANSPORTES NO APARECEN EN COLAS.;;BC-ABA;PROYECTO NIIF;PROYECTO NIIF;;;;CERRADO;;;;
30/05/2014;6000000051;ERROR EN VERIFICACION DE DISPONIBILIDAD;;SD-IS;PROYECTO NIIF;PROYECTO NIIF;;;;CERRADO;;;;
30/05/2014;6000000052;ERROR EN IMPRESIÓN DE CHEQUES;;TR-TM;PROYECTO NIIF;PROYECTO NIIF;;;;CERRADO;;;;
30/05/2014;6000000053;ERROR EN TIEMPO DE EJECUCION VF31;SAP;FI-AR;PROYECTO NIIF;PROYECTO NIIF;SIN USUARIO;SIN EMPRESA;SIN CONSULTOR;ANULADO;ANULADO;ANULADO;ANULADO;
30/05/2014;6000000054;NO CONTABILIZACIÓN RECIBO DE CAJA;;TR-TM;PROYECTO NIIF;PROYECTO NIIF;;;;CERRADO;;;;
30/05/2014;6000000055;ERROR EN TIEMPO DE EJECUCION VF31;SAP;FI-AR;PROYECTO NIIF;PROYECTO NIIF;;;;CERRADO;;;;
30/05/2014;6000000056;ERROR EN TIEMPO DE EJECUCION VF03;;SD-BIL;PROYECTO NIIF;PROYECTO NIIF;;;;CERRADO;;;;
30/05/2014;6000000057;SPAD NO SALE IMPRESION;;BC-ABA;PROYECTO NIIF;PROYECTO NIIF;;;;CERRADO;;;;
30/05/2014;6000000058;SP01 NO IMPRIME;;BC-ABA;PROYECTO NIIF;PROYECTO NIIF;;;;CERRADO;;;;
04/06/2014;6000000060;CANCELA OBJETO SD_VBRK;;BC-ABA;PROYECTO NIIF;PROYECTO NIIF;;;;CERRADO;;;;
04/06/2014;6000000061;TIEMPOS DE EJECUCIÓN MB1A;;;PROYECTO NIIF;PROYECTO NIIF;;;;CERRADO;;;;
04/06/2014;6000000062;ERROR TIEMPO DE EJECUCION MB1B;;;PROYECTO NIIF;PROYECTO NIIF;;;;CERRADO;;;;
04/06/2014;6000000063;ERROR ZFI002;SAP;FI-AR;PROYECTO NIIF;PROYECTO NIIF;;;;CERRADO;;;;
05/06/2014;6000000064;TRANSACCIÓN MB1B OBSOLETA;SAP;MM-IS;PROYECTO NIIF;PROYECTO NIIF;;;;CERRADO;;;;
05/06/2014;6000000065;TRANSACCIÓN MB02 OBSOLETA;SAP;MM-IS;PROYECTO NIIF;PROYECTO NIIF;;;;CERRADO;;;;
05/06/2014;6000000066;TRANSACCIÓN MB03 OBSOLETA;SAP;MM-IS;PROYECTO NIIF;PROYECTO NIIF;;;;CERRADO;;;;
05/06/2014;6000000067;TRANSACCIÓN MB03 OBSOLETA;SAP;MM-IS;PROYECTO NIIF;PROYECTO NIIF;SIN USUARIO;SIN EMPRESA;SIN CONSULTOR;ANULADO;ANULADO;ANULADO;ANULADO;
05/06/2014;6000000068;TRANSACCIÓN MB1A OBSOLETA;SAP;MM-IS;PROYECTO NIIF;PROYECTO NIIF;;;;CERRADO;;;;
05/06/2014;6000000069;TRANSACCIÓN MB1B OBSOLETA;SAP;MM-IS;PROYECTO NIIF;PROYECTO NIIF;;;;CERRADO;;;;
05/06/2014;6000000070;TRANSACCIÓN MB1C OBSOLETA;SAP;MM-IS;PROYECTO NIIF;PROYECTO NIIF;;;;CERRADO;;;;
05/06/2014;6000000071;ERROR TRANSACCIÓN ZMMOBSEQUIOS;SAP;MM-IS;PROYECTO NIIF;PROYECTO NIIF;;;;CERRADO;;;;
05/06/2014;6000000072;ERROR TRANSACCIÓN ZMMOBSEQUIOS;SAP;MM-IS;PROYECTO NIIF;PROYECTO NIIF;SIN USUARIO;SIN EMPRESA;SIN CONSULTOR;ANULADO;ANULADO;ANULADO;ANULADO;
05/06/2014;6000000073;NO PERMITE MODIFICAR EL GRUPO DE CUENTAS;SAP;MM-IS;PROYECTO NIIF;PROYECTO NIIF;;;;CERRADO;;;;
05/06/2014;6000000074;NO PERMITE MODIFICAR EN MASA PROVEEDORES;SAP;MM-IS;PROYECTO NIIF;PROYECTO NIIF;;;;CERRADO;;;;
09/06/2014;6000000080;NO GENERA REPORTE Y SACA ERROR;;CO-OM;PROYECTO NIIF;PROYECTO NIIF;;;;CERRADO;;;;
12/06/2014;6000000081;FALTA DE AUTORIZACIÓN CONTABILIZAR FBCJ;SAP;FI-GL;PROYECTO NIIF;PROYECTO NIIF;;;;CERRADO;;;;
12/06/2014;6000000082;NO GENERA EL REPORTE DE TARJETAS;;SD-IS;PROYECTO NIIF;PROYECTO NIIF;;;;CERRADO;;;;Trabajo en conjunto con Hasel Espinoza
23/06/2014;6000000090;VL02N BLOQUEO AL BORRAR ENTREGAS;;LE-SHP;PROYECTO NIIF;PROYECTO NIIF;SIN USUARIO;SIN EMPRESA;SIN CONSULTOR;ANULADO;ANULADO;ANULADO;ANULADO;
23/06/2014;6000000091;ERROR EN MIGO Y ZMIGO_ZT5;SAP;MM-IS;PROYECTO NIIF;PROYECTO NIIF;SIN USUARIO;SIN EMPRESA;SIN CONSULTOR;ANULADO;ANULADO;ANULADO;ANULADO;
23/06/2014;6000000092;ERROR AL ANULAR ENTREGA VL02N;;SD-IS;PROYECTO NIIF;PROYECTO NIIF;;;;CERRADO;;;;
23/06/2014;6000000093;ERROR MIGO NORMAL Y TRAZA;SAP;MM-IS;PROYECTO NIIF;PROYECTO NIIF;;;;CERRADO;;;;
25/06/2014;6000000094;ERROR CONTABILIZACIÓN MOV MCÍA MOV 602;;SD-IS;PROYECTO NIIF;PROYECTO NIIF;;;;CERRADO;;;;
26/06/2014;6000000095;ERROR CONTABILIZACIÓN AJUSTES INVENTARIO;SAP;MM-IS;PROYECTO NIIF;PROYECTO NIIF;;;;CERRADO;;;;
01/07/2014;6000000100;ERRORES CROSS SELLING;;SD-IS;PROYECTO NIIF;PROYECTO NIIF;;;;CERRADO;;;;
01/07/2014;6000000101;SALTOS EN RANGO DE FACTURACIÓN;;SD-IS;PROYECTO NIIF;PROYECTO NIIF;;;;CERRADO;;;;
02/07/2014;6000000110;ERROR EXTRACTO DE CUENTA ASOCIADOS;SAP;FI-GL;PROYECTO NIIF;PROYECTO NIIF;;;;CERRADO;;;;
03/07/2014;6000000111;ERROR ZEXTRACTO_ASOC;SAP;FI-BL-IS;PROYECTO NIIF;PROYECTO NIIF;;;;CERRADO;;;;
03/07/2014;6000000112;ERROR EN TRANSACCIÓN FBCJ;;TR-TM;PROYECTO NIIF;PROYECTO NIIF;;;;CERRADO;;;;
03/07/2014;6000000113;GRUPO DE OPERACIONES NO ACTUALIZADAS CO;;CO-PA;PROYECTO NIIF;PROYECTO NIIF;;;;CERRADO;;;;
11/07/2014;6000000120;NOVEDADES EHP7.;;BC-ABA;PROYECTO NIIF;PROYECTO NIIF;;;;CERRADO;;;;
24/09/2014;6000000130;MENSAJE DE PRUEBA CAPACITACIÓN 24-SEPT;WEB;FI-BL-IS;PROYECTO NIIF;PROYECTO NIIF;;;;CERRADO;;;;
25/09/2014;6000000131;MONITOREAR BD - TABLAS E INDICES;SAP;FI-BL-IS;PROYECTO NIIF;PROYECTO NIIF;;;;CERRADO;;;;
26/09/2014;6000000132;REPORTE OBSOLETO;SAP;FI-BL-IS;PROYECTO NIIF;PROYECTO NIIF;;;;CERRADO;;;;
27/09/2014;6000000133;NO SE PUEDE ABRIR PERIODOS Y LA VARIANTE;SAP;FI-BL-IS;PROYECTO NIIF;PROYECTO NIIF;;;;CERRADO;;;;
27/09/2014;6000000134;OBSOLETA;SAP;FI-BL-IS;PROYECTO NIIF;PROYECTO NIIF;;;;CERRADO;;;;
27/09/2014;6000000135;PARAMETROS NO ESTAN DEFINIDOS;SAP;FI-BL-IS;PROYECTO NIIF;PROYECTO NIIF;;;;CERRADO;;;;
29/09/2014;6000000140;DESPLAZAMIENTO DE PERIODOS MMPV;SAP;FI-BL-IS;PROYECTO NIIF;PROYECTO NIIF;;;;CERRADO;;;;
29/09/2014;6000000141;ERROR EN CARGUE DE BACH.;SAP;FI-BL-IS;PROYECTO NIIF;PROYECTO NIIF;;;;CERRADO;;;;
29/09/2014;6000000142;NO HAY AUTORIZACION PARA EL BALANCE;SAP;FI-BL-IS;PROYECTO NIIF;PROYECTO NIIF;;;;CERRADO;;;;
29/09/2014;6000000143;NO SE PUEDE CONTABILIZAR EN TRAN. F-43;SAP;FI-BL-IS;PROYECTO NIIF;PROYECTO NIIF;;;;CERRADO;;;;
29/09/2014;6000000144;NO SE PUEDE CONTABILIZAR EN TRAN. F-90;SAP;FI-BL-IS;PROYECTO NIIF;PROYECTO NIIF;;;;CERRADO;;;;
30/09/2014;6000000145;NO HAY AUTORIZACIÓN PARA EJECUTAR LF10N;SAP;FI-BL-IS;PROYECTO NIIF;PROYECTO NIIF;;;;CERRADO;;;;
30/09/2014;6000000146;ERROR CAPTURA PEDIDO DE VENTAS;SAP;FI-BL-IS;PROYECTO NIIF;PROYECTO NIIF;;;;CERRADO;;;;
30/09/2014;6000000147;PRUEBA ERROR TRANSACCION KCH4;SAP;FI-BL-IS;PROYECTO NIIF;PROYECTO NIIF;;;;CERRADO;;;;
30/09/2014;6000000148;NO ACCESO A LA TRANSACCION F.14;SAP;FI-BL-IS;PROYECTO NIIF;PROYECTO NIIF;;;;CERRADO;;;;
30/09/2014;6000000149;ERROR TRANSANCCION ZKP06;SAP;FI-BL-IS;PROYECTO NIIF;PROYECTO NIIF;;;;CERRADO;;;;
30/09/2014;6000000150;NO ES POSIBLE ACCEDER A LA TRANSACCION;SAP;FI-BL-IS;PROYECTO NIIF;PROYECTO NIIF;;;;CERRADO;;;;
01/10/2014;6000000151;NO SE PUEDEN REALIZAR TRASLADOS;SAP;FI-BL-IS;PROYECTO NIIF;PROYECTO NIIF;;;;CERRADO;;;;
01/10/2014;6000000152;SIN AUTORIZACION PARA LEDGER 0L;SAP;FI-BL-IS;PROYECTO NIIF;PROYECTO NIIF;;;;CERRADO;;;;
01/10/2014;6000000153;FALTA AUTORIZACIÓN TRANSACCIÓN FAGLB03;SAP;FI-BL-IS;PROYECTO NIIF;PROYECTO NIIF;;;;CERRADO;;;;
01/10/2014;6000000154;SIN AUTORIZACION PARA LEDGER 0L;WEB;FI-BL-IS;PROYECTO NIIF;PROYECTO NIIF;;;;CERRADO;;;;
01/10/2014;6000000155;ERROR TRANSANCCION KA06;SAP;FI-BL-IS;PROYECTO NIIF;PROYECTO NIIF;;;;CERRADO;;;;
01/10/2014;6000000156;NO PERMITE CONSULTAR TODO EL DOC FI;SAP;FI-BL-IS;PROYECTO NIIF;PROYECTO NIIF;;;;CERRADO;;;;
01/10/2014;6000000157;SIN AUTORIZACION PARA CONTABILIZAR EN SE;SAP;FI-BL-IS;PROYECTO NIIF;PROYECTO NIIF;;;;CERRADO;;;;
01/10/2014;6000000158;CONTABILIZACIÓN COBRO A PROVEEDORES;SAP;FI-BL-IS;PROYECTO NIIF;PROYECTO NIIF;;;;CERRADO;;;;
01/10/2014;6000000159;SIN AUTORIZACION PARA AM75;SAP;FI-BL-IS;PROYECTO NIIF;PROYECTO NIIF;;;;CERRADO;;;;
01/10/2014;6000000160;ANULACION DE DOCUMENTO;SAP;FI-BL-IS;PROYECTO NIIF;PROYECTO NIIF;;;;CERRADO;;;;
01/10/2014;6000000161;TRANSACCION F.01;SAP;FI-BL-IS;PROYECTO NIIF;PROYECTO NIIF;;;;CERRADO;;;;
02/10/2014;6000000162;SIN AUTORIZACION PARA CONTALIZAR SEGMENT;SAP;FI-BL-IS;PROYECTO NIIF;PROYECTO NIIF;;;;CERRADO;;;;
02/10/2014;6000000163;SIN AUTORIZACION PARA VISUALIZAR;SAP;FI-BL-IS;PROYECTO NIIF;PROYECTO NIIF;;;;CERRADO;;;;
02/10/2014;6000000164;NO SE PUEDE REALIZAR LA CONTABILIZACIÓN.;SAP;FI-BL-IS;PROYECTO NIIF;PROYECTO NIIF;;;;CERRADO;;;;
02/10/2014;6000000165;NO SE PUEDE REALIZAR LA CONTABILIZACIÓN;SAP;FI-BL-IS;PROYECTO NIIF;PROYECTO NIIF;;;;CERRADO;;;;
02/10/2014;6000000166;PERIODO CONTABLE NO ABIERTO;WEB;FI-BL-IS;PROYECTO NIIF;PROYECTO NIIF;;;;CERRADO;;;;
02/10/2014;6000000167;LISTA DE VISUALIZACION DIFERENTE A PRD;SAP;FI-BL-IS;PROYECTO NIIF;PROYECTO NIIF;;;;CERRADO;;;;
02/10/2014;6000000168;ERROR CONTABILIZACIÓN NÓMINA;WEB;FI-BL-IS;PROYECTO NIIF;PROYECTO NIIF;;;;CERRADO;;;;
02/10/2014;6000000169;NO SE PUEDE REALIZAR LA CONTABILIZACIÓN;SAP;FI-BL-IS;PROYECTO NIIF;PROYECTO NIIF;;;;CERRADO;;;;
02/10/2014;6000000170;ACCESO A AUTORIZACION PARA SEGMENTO;SAP;FI-BL-IS;PROYECTO NIIF;PROYECTO NIIF;;;;CERRADO;;;;
02/10/2014;6000000171;PANTALLA DE VISUALIZACION DIFERENTE;SAP;FI-BL-IS;PROYECTO NIIF;PROYECTO NIIF;;;;CERRADO;;;;
02/10/2014;6000000172;SIN ACCESO CONSULTA BALANCE;SAP;FI-BL-IS;PROYECTO NIIF;PROYECTO NIIF;;;;CERRADO;;;;
02/10/2014;6000000173;ACCESO A AUTORIZACION PARA SEGMENTO;SAP;FI-BL-IS;PROYECTO NIIF;PROYECTO NIIF;;;;CERRADO;;;;
02/10/2014;6000000174;VISUALIZACION TERCERA PANTALLA DETALLE D;SAP;FI-BL-IS;PROYECTO NIIF;PROYECTO NIIF;;;;CERRADO;;;;
02/10/2014;6000000175;NO SE PUEDE REALIZAR EL CARGUE;SAP;FI-BL-IS;PROYECTO NIIF;PROYECTO NIIF;;;;CERRADO;;;;
02/10/2014;6000000176;ERROR AL AEJECUTAR LA TRANSACCION;SAP;FI-BL-IS;PROYECTO NIIF;PROYECTO NIIF;;;;CERRADO;;;;
02/10/2014;6000000177;ERROR AL EJECUTAR LA TRAN ZFI023I;SAP;FI-BL-IS;PROYECTO NIIF;PROYECTO NIIF;;;;CERRADO;;;;
02/10/2014;6000000178;NO ES POSIBLE COMPENSAR POR FALTA DE AUT;SAP;FI-BL-IS;PROYECTO NIIF;PROYECTO NIIF;;;;CERRADO;;;;
02/10/2014;6000000179;SIN AUTORIZACION PARA CONTABILIZAR SEGME;SAP;FI-BL-IS;PROYECTO NIIF;PROYECTO NIIF;;;;CERRADO;;;;
02/10/2014;6000000180;NO SE PUEDE COMPENSAR DEUDORES;WEB;FI-BL-IS;PROYECTO NIIF;PROYECTO NIIF;;;;CERRADO;;;;
02/10/2014;6000000181;SIN AUTORIZACION PARA COMPENSAR;SAP;FI-BL-IS;PROYECTO NIIF;PROYECTO NIIF;;;;CERRADO;;;;
02/10/2014;6000000182;SIN AUTORIZACION PARA AM75;SAP;FI-BL-IS;PROYECTO NIIF;PROYECTO NIIF;;;;CERRADO;;;;
02/10/2014;6000000183;SIN AUTORIZACION;SAP;FI-BL-IS;PROYECTO NIIF;PROYECTO NIIF;;;;CERRADO;;;;
02/10/2014;6000000184;2015 CALENDARIO DE FABRICACION NO VALIDO;SAP;FI-BL-IS;PROYECTO NIIF;PROYECTO NIIF;;;;CERRADO;;;;
02/10/2014;6000000185;2015 CALENDARIO DE FABRICACION NO VALIDO;SAP;FI-BL-IS;PROYECTO NIIF;PROYECTO NIIF;;;;CERRADO;;;;
02/10/2014;6000000186;2015 CALENDARIO DE FABRICACION NO VALIDO;WEB;FI-BL-IS;PROYECTO NIIF;PROYECTO NIIF;;;;CERRADO;;;;
02/10/2014;6000000187;NO SE MODIFICA FECHA DE INGRESO 2015;SAP;FI-BL-IS;PROYECTO NIIF;PROYECTO NIIF;;;;CERRADO;;;;
02/10/2014;6000000188;CONTABILIZACIONES EN EL 2015 NO VALIDAS;SAP;FI-BL-IS;PROYECTO NIIF;PROYECTO NIIF;;;;CERRADO;;;;
03/10/2014;6000000189;NO REALIZA LA CONTABILIZACIÓN;SAP;FI-BL-IS;PROYECTO NIIF;PROYECTO NIIF;;;;CERRADO;;;;
03/10/2014;6000000190;NO REALIZA LA CONTABILIZACIÓN;WEB;FI-BL-IS;PROYECTO NIIF;PROYECTO NIIF;;;;CERRADO;;;;
03/10/2014;6000000191;NO REALIZA LA CONTABILIZACIÓN;SAP;FI-BL-IS;PROYECTO NIIF;PROYECTO NIIF;;;;CERRADO;;;;
03/10/2014;6000000192;NO REALIZA LA CONTABILIZACIÓN;WEB;FI-BL-IS;PROYECTO NIIF;PROYECTO NIIF;;;;CERRADO;;;;
03/10/2014;6000000193;NO TENGO AUTORIZACION VISUALIZAR LEDGER;WEB;FI-BL-IS;PROYECTO NIIF;PROYECTO NIIF;;;;CERRADO;;;;
03/10/2014;6000000194;ERROR POR CENTRO DE BENEFICIO;SAP;FI-BL-IS;PROYECTO NIIF;PROYECTO NIIF;;;;CERRADO;;;;
03/10/2014;6000000195;SE NESECITA DESGLOSE POR CEBE;SAP;FI-BL-IS;PROYECTO NIIF;PROYECTO NIIF;;;;CERRADO;;;;
03/10/2014;6000000196;NO SE PUEDEN ANULAR DOCUMENTOS;SAP;FI-BL-IS;PROYECTO NIIF;PROYECTO NIIF;;;;CERRADO;;;;
03/10/2014;6000000197;NO ES POSIBLE ANULAR;WEB;FI-BL-IS;PROYECTO NIIF;PROYECTO NIIF;;;;CERRADO;;;;
03/10/2014;6000000198;NO ES POSIBLE ANULAR;SAP;FI-BL-IS;PROYECTO NIIF;PROYECTO NIIF;;;;CERRADO;;;;
03/10/2014;6000000199;NO SE PUEDE CONTABILIZAR.;SAP;FI-BL-IS;PROYECTO NIIF;PROYECTO NIIF;;;;CERRADO;;;;
04/10/2014;6000000200;ERROR CONTABILIZACION F-02;SAP;FI-BL-IS;PROYECTO NIIF;PROYECTO NIIF;;;;CERRADO;;;;
04/10/2014;6000000201;FALTA ASIGNAR CENTRO DE COSTOS;SAP;FI-BL-IS;PROYECTO NIIF;PROYECTO NIIF;;;;CERRADO;;;;
06/10/2014;6000000205;PANTALLA DE VISUALIZACION DIFERENTE;SAP;FI-BL-IS;PROYECTO NIIF;PROYECTO NIIF;;;;CERRADO;;;;
06/10/2014;6000000206;ERROR DE VISUALIZACION;SAP;FI-BL-IS;PROYECTO NIIF;PROYECTO NIIF;;;;CERRADO;;;;
06/10/2014;6000000207;PERIODO DE CONTABILIZACION SIN APERTURA;SAP;FI-BL-IS;PROYECTO NIIF;PROYECTO NIIF;;;;CERRADO;;;;
06/10/2014;6000000208;PERIODO DE CONTABILIZACION SIN APERTURA;SAP;FI-BL-IS;PROYECTO NIIF;PROYECTO NIIF;;;;CERRADO;;;;
06/10/2014;6000000209;FALTA AUTORIZACION;SAP;FI-BL-IS;PROYECTO NIIF;PROYECTO NIIF;;;;CERRADO;;;;
06/10/2014;6000000210;EL DOCUMENTO GENERADO NO APARECE IMPRESO;SAP;FI-BL-IS;PROYECTO NIIF;PROYECTO NIIF;;;;CERRADO;;;;
06/10/2014;6000000211;PERIODO DE CONTABILIZACION SIN APERTURA;SAP;FI-BL-IS;PROYECTO NIIF;PROYECTO NIIF;;;;CERRADO;;;;
06/10/2014;6000000212;ERROR AL AEJECUTAR LA TRAN F.01;SAP;FI-BL-IS;PROYECTO NIIF;PROYECTO NIIF;;;;CERRADO;;;;
06/10/2014;6000000213;ACCESO A LEDGER OL EN SOCIEDAD 1000;SAP;FI-BL-IS;PROYECTO NIIF;PROYECTO NIIF;;;;CERRADO;;;;
06/10/2014;6000000214;ERROR AL EJECUTAR TRANS F-28;SAP;FI-BL-IS;PROYECTO NIIF;PROYECTO NIIF;;;;CERRADO;;;;
07/10/2014;6000000215;NO TIENE AUTORIZACION PARA EL SEGMENTO;SAP;FI-BL-IS;PROYECTO NIIF;PROYECTO NIIF;;;;CERRADO;;;;
07/10/2014;6000000216;CAMPO P. BALANCE CENTRO DE BENEFICIO;SAP;FI-BL-IS;PROYECTO NIIF;PROYECTO NIIF;;;;CERRADO;;;;
07/10/2014;6000000217;F-32.;SAP;FI-BL-IS;PROYECTO NIIF;PROYECTO NIIF;;;;CERRADO;;;;
07/10/2014;6000000218;NO PERMITE LA CONTABILIZACION F-43;SAP;FI-BL-IS;PROYECTO NIIF;PROYECTO NIIF;;;;CERRADO;;;;
07/10/2014;6000000219;FALTA DE AUTORIZACION FAGLB03;SAP;FI-BL-IS;PROYECTO NIIF;PROYECTO NIIF;;;;CERRADO;;;;
07/10/2014;6000000220;F.01 SIN GENERAR;SAP;FI-BL-IS;PROYECTO NIIF;PROYECTO NIIF;;;;CERRADO;;;;
07/10/2014;6000000221;NO PERMITE REGISTRAR TRANSACCIONES;SAP;FI-BL-IS;PROYECTO NIIF;PROYECTO NIIF;;;;CERRADO;;;;
07/10/2014;6000000222;ERROR EN CONTABILIZACION;SAP;FI-BL-IS;PROYECTO NIIF;PROYECTO NIIF;;;;CERRADO;;;;
07/10/2014;6000000223;COMPENSAR LAS PARTIDAS DE UN ACREEDOR QU;SAP;FI-BL-IS;PROYECTO NIIF;PROYECTO NIIF;;;;CERRADO;;;;
07/10/2014;6000000224;NO PUEDE CONSULTAR SALDOS DE CUENTAS;SAP;FI-BL-IS;PROYECTO NIIF;PROYECTO NIIF;;;;CERRADO;;;;
07/10/2014;6000000225;NO SE PUEDE GENERAR LA TRANSACCION;SAP;FI-BL-IS;PROYECTO NIIF;PROYECTO NIIF;;;;CERRADO;;;;
07/10/2014;6000000226;NO EJECUTA LA TRANSACCION;SAP;FI-BL-IS;PROYECTO NIIF;PROYECTO NIIF;;;;CERRADO;;;;
07/10/2014;6000000227;ERROR TRANSANCCION KS04;SAP;FI-BL-IS;PROYECTO NIIF;PROYECTO NIIF;;;;CERRADO;;;;
07/10/2014;6000000228;ERROR TRANSANCCION KS14;SAP;FI-BL-IS;PROYECTO NIIF;PROYECTO NIIF;;;;CERRADO;;;;
07/10/2014;6000000229;ERROR CREAR FACTURA PROVEEDOR;SAP;FI-BL-IS;PROYECTO NIIF;PROYECTO NIIF;;;;CERRADO;;;;
07/10/2014;6000000230;NO TENGO AUTORIZACION TRANSACCION  ZFI01;SAP;FI-BL-IS;PROYECTO NIIF;PROYECTO NIIF;;;;CERRADO;;;;
07/10/2014;6000000231;NO TENGO AUTORIZACION TRANSACCION  ZFI01;SAP;FI-BL-IS;PROYECTO NIIF;PROYECTO NIIF;;;;CERRADO;;;;
07/10/2014;6000000232;NO TENGO AUTORIZACION A LA SEGMENTACION;SAP;FI-BL-IS;PROYECTO NIIF;PROYECTO NIIF;;;;CERRADO;;;;
07/10/2014;6000000233;NO TENGO AUTORIZACION TRANSACCION  FB50;SAP;FI-BL-IS;PROYECTO NIIF;PROYECTO NIIF;;;;CERRADO;;;;
07/10/2014;6000000234;SIN AUTORIZACION TRANSACCION F.01;SAP;FI-BL-IS;PROYECTO NIIF;PROYECTO NIIF;;;;CERRADO;;;;
07/10/2014;6000000235;NO TENGO AUTORIZACION A LA SEGMENTACION;SAP;FI-BL-IS;PROYECTO NIIF;PROYECTO NIIF;;;;CERRADO;;;;
07/10/2014;6000000236;NO TENGO UTORIZACION TRANSACCION F.08;SAP;FI-BL-IS;PROYECTO NIIF;PROYECTO NIIF;;;;CERRADO;;;;
07/10/2014;6000000237;NO AUTORIZACION PARA SEGMENTO F-02;SAP;FI-BL-IS;PROYECTO NIIF;PROYECTO NIIF;;;;CERRADO;;;;
07/10/2014;6000000238;NO ME PERMITE REALIZ LA TRANSACCION FBRA;SAP;FI-BL-IS;PROYECTO NIIF;PROYECTO NIIF;;;;CERRADO;;;;
07/10/2014;6000000239;SIN AUTORIZACION  TRANSACCION F-02;SAP;FI-BL-IS;PROYECTO NIIF;PROYECTO NIIF;;;;CERRADO;;;;
07/10/2014;6000000240;SIN AUTORIZACION  TRANSACCION F-03;SAP;FI-BL-IS;PROYECTO NIIF;PROYECTO NIIF;;;;CERRADO;;;;
07/10/2014;6000000241;ERROR DE AUTORIZAC VISUALIZACION DOC. AA;SAP;FI-BL-IS;PROYECTO NIIF;PROYECTO NIIF;;;;CERRADO;;;;
07/10/2014;6000000242;NO AUTORIZACION PARA SEGMENTO F-43;SAP;FI-BL-IS;PROYECTO NIIF;PROYECTO NIIF;;;;CERRADO;;;;
07/10/2014;6000000243;NO PERMITE REALIZAR LA ANULACION DE DOCU;SAP;FI-BL-IS;PROYECTO NIIF;PROYECTO NIIF;;;;CERRADO;;;;
07/10/2014;6000000244;NO COMPENSA EN TRANSACCION F-44;SAP;FI-BL-IS;PROYECTO NIIF;PROYECTO NIIF;;;;CERRADO;;;;
07/10/2014;6000000245;SIN AUTORIZACION  C.C TRANSACCION F-44;SAP;FI-BL-IS;PROYECTO NIIF;PROYECTO NIIF;;;;CERRADO;;;;
07/10/2014;6000000246;COMPENSACION CUENTAS DE BANCOS;SAP;FI-BL-IS;PROYECTO NIIF;PROYECTO NIIF;;;;CERRADO;;;;
07/10/2014;6000000247;ERROR VISUALIZACION DOCUMENTO;SAP;FI-BL-IS;PROYECTO NIIF;PROYECTO NIIF;;;;CERRADO;;;;
07/10/2014;6000000248;CARGUE DE MOVIMIENTO BANCARIO;SAP;FI-BL-IS;PROYECTO NIIF;PROYECTO NIIF;;;;CERRADO;;;;
07/10/2014;6000000249;ERROR DE AUTORIZAC VISUALIZACION DOC. AA;SAP;FI-BL-IS;PROYECTO NIIF;PROYECTO NIIF;;;;CERRADO;;;;
07/10/2014;6000000250;NO HAY VISUALIZACION DE DOCUMENTO FB03;SAP;FI-BL-IS;PROYECTO NIIF;PROYECTO NIIF;;;;CERRADO;;;;
07/10/2014;6000000251;NO ME PERMITE ENTRAR A ESTA TRANSCCION;SAP;FI-BL-IS;PROYECTO NIIF;PROYECTO NIIF;;;;CERRADO;;;;
07/10/2014;6000000252;SIN AUTORIZACION BORRAR TRANSACCION FB08;SAP;FI-BL-IS;PROYECTO NIIF;PROYECTO NIIF;;;;CERRADO;;;;
07/10/2014;6000000253;ERROR AL IMPUTAR CECO Y/O DIVISIONES;SAP;FI-BL-IS;PROYECTO NIIF;PROYECTO NIIF;;;;CERRADO;;;;
07/10/2014;6000000254;ERROR EN  ZCDSD_CORREOS_PLANILLAS;SAP;FI-BL-IS;PROYECTO NIIF;PROYECTO NIIF;;;;CERRADO;;;;
07/10/2014;6000000255;VISUALIZACION DOCUMENTO;SAP;FI-BL-IS;PROYECTO NIIF;PROYECTO NIIF;;;;CERRADO;;;;
07/10/2014;6000000256;ERROR AL EJECUTAR TRANS;SAP;FI-BL-IS;PROYECTO NIIF;PROYECTO NIIF;;;;CERRADO;;;;
07/10/2014;6000000257;2015 CALENDARIO DE FABRICACION NO VALIDO;SAP;FI-BL-IS;PROYECTO NIIF;PROYECTO NIIF;;;;CERRADO;;;;
07/10/2014;6000000258;2015 CALENDARIO DE FABRICACION NO VALIDO;SAP;FI-BL-IS;PROYECTO NIIF;PROYECTO NIIF;;;;CERRADO;;;;
07/10/2014;6000000259;2015 CALENDARIO DE FABRICACION NO VALIDO;SAP;FI-BL-IS;PROYECTO NIIF;PROYECTO NIIF;;;;CERRADO;;;;
07/10/2014;6000000260;NO SE PUEDE MODIFICAR FECHA;SAP;FI-BL-IS;PROYECTO NIIF;PROYECTO NIIF;;;;CERRADO;;;;
08/10/2014;6000000261;ERROR EN LA TRANSACCION MB1B;SAP;FI-BL-IS;PROYECTO NIIF;PROYECTO NIIF;;;;CERRADO;;;;
08/10/2014;6000000262;NO TENGO AUTORIZACION  TRANSACCION  F-22;SAP;FI-BL-IS;PROYECTO NIIF;PROYECTO NIIF;;;;CERRADO;;;;
08/10/2014;6000000263;NO TENGO AUTORIZACION PARA LA TRANSACCIO;SAP;FI-BL-IS;PROYECTO NIIF;PROYECTO NIIF;;;;CERRADO;;;;
08/10/2014;6000000264;TRANSACCION MIGO CONTABILIZACION Z05;WEB;FI-BL-IS;PROYECTO NIIF;PROYECTO NIIF;;;;CERRADO;;;;
08/10/2014;6000000265;ERROR TRANSACCION ZMIRO5NTI;SAP;FI-BL-IS;PROYECTO NIIF;PROYECTO NIIF;;;;CERRADO;;;;
08/10/2014;6000000266;NO SE PUEDE REALIZAR PRUEBAS A LA TRANSA;SAP;FI-BL-IS;PROYECTO NIIF;PROYECTO NIIF;;;;CERRADO;;;;
08/10/2014;6000000267;FALTA AUTORIZACION TRANSACCION;SAP;FI-BL-IS;PROYECTO NIIF;PROYECTO NIIF;;;;CERRADO;;;;
08/10/2014;6000000268;SIN AUTORIZACIÓN SEGMENTO COPI_01_SP;SAP;FI-BL-IS;PROYECTO NIIF;PROYECTO NIIF;;;;CERRADO;;;;
08/10/2014;6000000269;SIN AUTORIZACIÓN SEGMENTO COPI_01_SP;SAP;FI-BL-IS;PROYECTO NIIF;PROYECTO NIIF;;;;CERRADO;;;;
08/10/2014;6000000270;NO SE PUEDE REALIZAR PRUEBAS A LA TRANSA;SAP;FI-BL-IS;PROYECTO NIIF;PROYECTO NIIF;;;;CERRADO;;;;
08/10/2014;6000000271;NO SALE IMPRESION FISICA VF03;WEB;FI-BL-IS;PROYECTO NIIF;PROYECTO NIIF;;;;CERRADO;;;;
08/10/2014;6000000272;VF01 NO SALE LA IMPRESION DE LA FACTURA;SAP;FI-BL-IS;PROYECTO NIIF;PROYECTO NIIF;;;;CERRADO;;;;
08/10/2014;6000000273;LA TRANSAC. SOLICITA AUTORIZAC SEGMENTO;SAP;FI-BL-IS;PROYECTO NIIF;PROYECTO NIIF;;;;CERRADO;;;;
08/10/2014;6000000274;ERROR EN LA TRANSACCION MB1B;SAP;FI-BL-IS;PROYECTO NIIF;PROYECTO NIIF;;;;CERRADO;;;;
08/10/2014;6000000275;NO SE PUEDE REALIZAR PRUEBAS A LA TRANSA;WEB;FI-BL-IS;PROYECTO NIIF;PROYECTO NIIF;;;;CERRADO;;;;
08/10/2014;6000000276;SIN AUTORIZACIÓN PARA SEGMENTO COPI_01_S;SAP;FI-BL-IS;PROYECTO NIIF;PROYECTO NIIF;;;;CERRADO;;;;
08/10/2014;6000000277;NO SE TIENE AUTORIZACION - SEGMENTACION;SAP;FI-BL-IS;PROYECTO NIIF;PROYECTO NIIF;;;;CERRADO;;;;
08/10/2014;6000000278;NO SE PUEDE VISUALIZAR EL DOC GENERADO;WEB;FI-BL-IS;PROYECTO NIIF;PROYECTO NIIF;;;;CERRADO;;;;
08/10/2014;6000000279;SIN AUTORIZACIÓN PARA SEGMENTO COPI_01_S;SAP;FI-BL-IS;PROYECTO NIIF;PROYECTO NIIF;;;;CERRADO;;;;
08/10/2014;6000000280;SIN AUTORIZACIÓN PARA SEGMENTO COPI_01_S;WEB;FI-BL-IS;PROYECTO NIIF;PROYECTO NIIF;;;;CERRADO;;;;
08/10/2014;6000000281;NO PERMITE INGRESO MCIA POR LA Z05;SAP;FI-BL-IS;PROYECTO NIIF;PROYECTO NIIF;;;;CERRADO;;;;
08/10/2014;6000000282;PENDIENTE POR AUTORIZACION;SAP;FI-BL-IS;PROYECTO NIIF;PROYECTO NIIF;;;;CERRADO;;;;
08/10/2014;6000000283;PENDIENTE POR AUTORIZACION;SAP;FI-BL-IS;PROYECTO NIIF;PROYECTO NIIF;;;;CERRADO;;;;
08/10/2014;6000000284;PENDIENTE POR AUTORIZACION;SAP;FI-BL-IS;PROYECTO NIIF;PROYECTO NIIF;;;;CERRADO;;;;
08/10/2014;6000000285;PENDIENTE POR AUTORIZACION;SAP;FI-BL-IS;PROYECTO NIIF;PROYECTO NIIF;;;;CERRADO;;;;
08/10/2014;6000000286;ERROR AL GENERAR CONSULTA;SAP;FI-BL-IS;PROYECTO NIIF;PROYECTO NIIF;;;;CERRADO;;;;
08/10/2014;6000000287;ERROR EN PRUEBA VF01;SAP;FI-BL-IS;PROYECTO NIIF;PROYECTO NIIF;;;;CERRADO;;;;
08/10/2014;6000000288;NO SE PUEDE REGISTRAR FACT. X COMPRA AA;SAP;FI-BL-IS;PROYECTO NIIF;PROYECTO NIIF;;;;CERRADO;;;;
08/10/2014;6000000289;NO SE TIENE AUTORIZACIÓN PARA SEGMENTO;SAP;FI-BL-IS;PROYECTO NIIF;PROYECTO NIIF;;;;CERRADO;;;;
08/10/2014;6000000290;NO PERMITE GENERA NOTA A PROVEEDOR;SAP;FI-BL-IS;PROYECTO NIIF;PROYECTO NIIF;;;;CERRADO;;;;
