05/02/2018;7000001748;EWM:AJUSTES EN FACTURACION ;SAP;MM-IS;PROYECTO EWM;PROYECTO EWM;;;PROYECTO EWM;DESARROLLO CONSULTORIA;;;;Se encuentra configurado para Bello y Pereira. El requerimiento se cierra una vez este configurado para todas las regionales en EWM.
05/02/2018;7000001749;CHAT CRUCERO 2019;WEB;;DESARROLLO EMPRESARIAL;RECREACION Y DEPORTES;;WAPLICACIONES;ALEJANDRO ARDILA;CERRADO;;;17/05/2018;
06/02/2018;7000001750;WA: REPLICAR BOTONES NUEVOS SIP VENDEDORES;;SD-IS;COMERCIAL;VENTAS;;WAPLICACIONES;ALEJANDRO ARDILA;CERRADO;06/02/2018;;03/07/2018;
07/02/2018;7000001751;WA: INCON. ENVÍO CORREOS FAES – 7000001751;;SD-IS;COMERCIAL;COMERCIAL;;WAPLICACIONES;ALEJANDRO ARDILA;CERRADO;;;;
07/02/2018;7000001752;WA: IMPLEMENTACIÓN ESTRUCTURA PLAN MAX ;;SD-IS;COMERCIAL;SOPORTE TECNOLOGICO;;WAPLICACIONES;ALEJANDRO ARDILA;CERRADO;13/02/2018;;06/03/2018;
08/02/2018;7000001753;CREACIÓN ARCHIVO PLANO NOTAS DEVOLUCION ;SAP;;COMERCIAL;SOPORTE TECNOLOGICO;;CONSULTORIA ORGANIZACIONAL ;SANDRA MILENA NIÑO;CERRADO;08/02/2018;;23/04/2018;
08/02/2018;7000001754;MODIFICACION PLAZOS FACTURACION TERCEROS ;;SD-IS;COMERCIAL;SOPORTE TECNOLOGICO;WILTER CASTRO;INSAP CONSULTORIA ;GIOVNNI LOPEZ URBINA;CERRADO;08/02/2018;;10/07/2018;
08/02/2018;7000001755;WA:ERROR HORA CONFIRMACION PEDIDO TERCERO;;SD-IS;COMERCIAL;VENTAS;;WAPLICACIONES;ALEJANDRO ARDILA;CERRADO;13/02/2018;;06/03/2018;
08/02/2018;7000001756;EWM: ACTIVACION OUTPUT REA0;SAP;MM-IS;PROYECTO EWM;PROYECTO EWM;;;PROYECTO EWM;DESARROLLO CONSULTORIA;;;;Se encuentra configurado para Bello y Pereira. El requerimiento se cierra una vez este configurado para todas las regionales en EWM.
08/02/2018;7000001757;WA:ERROR DESCARGUE INFO MODULO ASOCIADO;WEB;;COMERCIAL;MERCADEO;JOHANN BEDOYA;WAPLICACIONES;ALEJANDRO ARDILA;DESARROLLO CONSULTORIA;8/2/2018;;;
09/02/2018;7000001758;EXCLUIR DESCUENTO EN TERCER Y PREASO;;;COMERCIAL;SOPORTE TECNOLOGICO;;SIN ASIGNAR;SIN ASIGNAR;NUEVO;;;;
09/02/2018;7000001759;PLAN CRECIMIENTO ICOM;BO;;COMERCIAL;MARCAS PROPIAS;LILIIANA;CONSULTORIA ORGANIZACIONAL ;RAUL AMAYA;DESARROLLO CONSULTORIA;03/08/2018;;;A espere ade reunio para redifinicion del alcance del requerimiento
13/02/2018;7000001760;IN: ERROR DESCARGA SALIDA MERCANCIA ;;SD-IS;CONTRALORIA;CEDIS;;WAPLICACIONES;ALEJANDRO ARDILA;CERRADO;19/02/2018;;06/03/2018;
13/02/2018;7000001761;WA: ERROR VISUAL LOTE ECONOMICO CAPTURA ;;SD-IS;COMERCIAL;VENTAS;;WAPLICACIONES;ALEJANDRO ARDILA;CERRADO;19/02/2018;;06/03/2018;
13/02/2018;7000001762;WA: ERROR DESCUENTO EN COMPRAS;;SD-IS;CONTRALORIA;CARTERA;;WAPLICACIONES;ALEJANDRO ARDILA;CERRADO;;;27/04/2018;
15/02/2018;7000001763;EWM: ESPECIFI. FUNCIONAL DETER. CLASE ENTREGA ENTRANTE   ;;;PROYECTO EWM;PROYECTO EWM;;;PROYECTO EWM;DESARROLLO CONSULTORIA;;;;Pdt. Validaciones en dev prima del Usuario 
15/02/2018;7000001764;EWM: CONFIGURACIÓN MENSAJE SPER ;WEB;SD-IS;PROYECTO EWM;PROYECTO EWM;;;PROYECTO EWM;DESARROLLO CONSULTORIA;;;;Jose/ Solicitud de estado de requerimiento 26/06/2018
15/02/2018;7000001765;WA: INTEGRACION BO – PLAN COMPRE YA ;;SD-IS;COMERCIAL;VENTAS;;WAPLICACIONES;ALEJANDRO ARDILA;DESARROLLO CONSULTORIA;;;;En desarrollo
16/02/2018;7000001766;ERROR TRANSFE DROG ALLE;;SD-IS;COMERCIAL;SOPORTE TECNOLOGICO;;WAPLICACIONES;ALEJANDRO ARDILA;CERRADO;;;04/04/2018;
19/02/2018;7000001770;CLASE DOCUMENTO 90 Y 120 DÍAS ;WEB;SD-IS;COMERCIAL;SOPORTE TECNOLOGICO;;SIN ASIGNAR;SIN ASIGNAR;NUEVO;;;;
19/02/2018;7000001771;WA: SOPORTE APP PROVEEDORES;;SD-IS;COMERCIAL;VENTAS;;WAPLICACIONES;ALEJANDRO ARDILA;DESARROLLO CONSULTORIA;;;;
19/02/2018;7000001772;CONTABILIZACIONES SD. - ZCDFI_POSTING_SD - NEWGL ;SAP;FI-BL-IS;CONTRALORIA;CONTABILIDAD;PABLO MESA ;APM CONSULTING S.A.S.;ANGELA CARIDAD PIÑERO MORA;VALIDACION PRD;07/03/2018;;;Validaciones en PRD por el Usuario Este proceso solo es posible correrlo al cierre del mes  y una sola vez. Por lo anterior lo ejecutaremos y revisaremos los aspectos que fueron revisados en el programa.
19/02/2018;7000001773;ERROR CARGUE EXTRACTO MULTICAHS BANCOLOBIA;SAP;FI;CONTRALORIA;CONTABILIDAD;;APM CONSULTING S.A.S.;ANGELA CARIDAD PIÑERO MORA;CERRADO;20/02/2018;;26/02/2018;
19/02/2018;7000001774;WA: ERROR TRANSFER EVENTO NOV ;;SD-IS;COMERCIAL;VENTAS;;WAPLICACIONES;ALEJANDRO ARDILA;CERRADO;20/02/2018;;06/03/2018;
20/02/2018;7000001775;MODIFI. DESARROLLO TRANSACCIÓN ZFIFACASO ;SAP;;COMERCIAL;SOPORTE TECNOLOGICO;WILTER CASTRO;N2N BUSINESS SOLUTIONS S.A.S;HANSEL DAVID ESPINOZA;PRUEBAS QAS;05/03/2018;;;se escala paso a PRD de Ots
20/02/2018;7000001776;OPCION VISUALIZACION TRANSACCION ZF014 ;SAP;;COMERCIAL;SOPORTE TECNOLOGICO;;N2N BUSINESS SOLUTIONS S.A.S;HANSEL DAVID ESPINOZA;VALIDACION PRD;05/03/2018;;;Pendiente VALIDACION PASO A PRD / ASIGNAR USUARIO   / auditoria 
20/02/2018;7000001777;MODIFI. TX FB05 DESARR. ZFI_TRASLADO_AYC ;SAP;;COMERCIAL;SOPORTE TECNOLOGICO;;N2N BUSINESS SOLUTIONS S.A.S;HANSEL DAVID ESPINOZA;VALIDACION PRD;05/03/2018;;;Pendiente paso PRD  / auditoria
20/02/2018;7000001778;MODIFI. TX. FB05 - DESARR. ZFI008_OPT;SAP;;COMERCIAL;SOPORTE TECNOLOGICO;;N2N BUSINESS SOLUTIONS S.A.S;HANSEL DAVID ESPINOZA;VALIDACION PRD;05/03/2018;;;Pendiente paso PRD  / auditoria
20/02/2018;7000001779;IN: ERROR TELEFONOS IMANES ;;SD-IS;DESARROLLO EMPRESARIAL;TRADE MARKETING;;WAPLICACIONES;ALEJANDRO ARDILA;CERRADO;21/02/2018;;06/03/2018;
20/02/2018;7000001780;WA: ERROR RECHAZO TRANSFER. PROCESADAS ;;SD-IS;COMERCIAL;VENTAS;;WAPLICACIONES;ALEJANDRO ARDILA;CERRADO;21/02/2018;;06/03/2018;
21/02/2018;7000001781;WA: ERROR FILTORS EVALUACIONES ;;SD-IS;COMERCIAL;MARCAS PROPIAS;;WAPLICACIONES;ALEJANDRO ARDILA;CERRADO;23/02/2018;;26/02/2018;
21/02/2018;7000001782;WA: ERROR ENCUESTA INTRANET COLABORADORES ;;SD-IS;GENERAL;COMUNICACIONES;;WAPLICACIONES;ALEJANDRO ARDILA;CERRADO;;;21/02/2018;
21/02/2018;7000001783;WA:ERROR TRANSFER.ESTAD.PENDIEN.MAYOR-20 ;;SD-IS;COMERCIAL;VENTAS;;WAPLICACIONES;ALEJANDRO ARDILA;CERRADO;;;09/03/2018;
21/02/2018;7000001784;WA:ERROR PROVEEDOR.CON DIVISION DE NEGOCIO ;;SD-IS;COMERCIAL;VENTAS;;WAPLICACIONES;ALEJANDRO ARDILA;CERRADO;23/02/2018;;06/03/2018;
22/02/2018;7000001785;WA: ERROR VISUALIZACIÓN PLAN ALIANZA ;;SD-IS;COMERCIAL;VENTAS;;WAPLICACIONES;ALEJANDRO ARDILA;CERRADO;;;22/02/2018;
22/02/2018;7000001786;EWM: ESPECIF. FUNCIONAL ACTUALI. GTIN14- 7000001786;WEB;SD-IS;PROYECTO EWM;PROYECTO EWM;MARIO CASTRO;INSAP CONSULTORIA ;GIOVNNI LOPEZ URBINA;DESARROLLO CONSULTORIA;28/02/2018;;;Asigando a Giovanni para ajustes
22/02/2018;7000001787;WA: ERROR SIP DEVOLUCIONES ;;SD-IS;COMERCIAL;VENTAS;;WAPLICACIONES;ALEJANDRO ARDILA;DESARROLLO CONSULTORIA;;;;
23/02/2018;7000001788;IN: ERROR CATEGORIZADORES ;;SD-IS;DESARROLLO EMPRESARIAL;TRADE MARKETING;;INTERFACES;INTERFACES;CERRADO;01/03/2018;;06/03/2018;
26/02/2018;7000001790;AJUSTE ALMACENAMIENTO TABLA ZCDSDKT14;WEB;FI-BL-IS;COMERCIAL;SOPORTE TECNOLOGICO;JOHANN BEDOYA;GIOVNNI LOPEZ URBINA;GIOVNNI LOPEZ URBINA;CERRADO;26/02/2018;;16/08/2018;
26/02/2018;7000001790;AJUSTE ALMACENAMIENTO TABLA ZCDSDKT14;SAP;FI-BL-IS;COMERCIAL;SOPORTE TECNOLOGICO;JOHANN BEDOYA;GIOVNNI LOPEZ URBINA;GIOVNNI LOPEZ URBINA;CERRADO;26/02/2018;;16/08/2018;
26/02/2018;7000001791;EWM: ERRO WHEN IMPORTING OBJECT XLIKP ;SAP;SD-IS;PROYECTO EWM;PROYECTO EWM;;;PROYECTO EWM;DESARROLLO CONSULTORIA;;;;Jose/ Solicitud de estado de requerimiento 26/06/2018
26/02/2018;7000001792;WA: ERROR CALCULO DE PRECIOS KIT VIRTUAL;;SD-IS;COMERCIAL;VENTAS;;WAPLICACIONES;ALEJANDRO ARDILA;CERRADO;;;02/03/2018;
26/02/2018;7000001793;EWM: ESPECIFI.FUNCIONAL O.C. LOTE POSICION ;WEB;SD-IS;PROYECTO EWM;PROYECTO EWM;MARIO CASTRO;JOSE MACIAS CHACON;JOSE MACIAS CHACON;DESARROLLO CONSULTORIA;28/02/2018;;;Pendiente integración de EWM
26/02/2018;7000001794;WA: ANEXAR COLUMNA ID TRANSFERENCISTAS ;;SD-IS;COMERCIAL;VENTAS;;WAPLICACIONES;ALEJANDRO ARDILA;CERRADO;06/03/2018;;09/03/2018;
26/02/2018;7000001795;NOTAS VS FACTURAS ;SAP;;COMERCIAL;SOPORTE TECNOLOGICO;WILTER CASTRO;N2N BUSINESS SOLUTIONS S.A.S;HANSEL DAVID ESPINOZA;CERRADO;05/03/2018;;10/08/2018;
27/02/2018;7000001796;EWM: ESPECIFI. FUNCIONAL AJUSTE PROGRAMA ;WEB;SD-IS;PROYECTO EWM;PROYECTO EWM;MARIO CASTRO;JOSE MACIAS CHACON;JOSE MACIAS CHACON;DESARROLLO CONSULTORIA;28/02/2018;;;Las ordenes de transporte generadas para este requerimiento son la creadas por la consultoría ABAP asignada. Una vez se defina la conformación de los ambientes QAS y PRD integrados a EWM se debe hacer la aplicación de la ordenes de transporte según la definición de la consultoría ABAP
27/02/2018;7000001797;MODIF. INCAPACIDAD FEBRERO BASE 30 DIAS;SAP;HCM;ADMINISTRATIVA;GESTION HUMANA;YULY JIMENEZ;HR SOLUTIONS;HR SOLUTIONS;CERRADO;28/02/2018;;03/05/2018;
28/02/2018;7000001798;WA: MENSAJES ;;SD-IS;COMERCIAL;VENTAS;;WAPLICACIONES;ALEJANDRO ARDILA;CERRADO;28/02/2018;;03/04/2018;
28/02/2018;7000001799;WA:ADMON PAG/WEB Y APLICACIONES MARZ.2018;;SD-IS;COMERCIAL;SOPORTE TECNOLOGICO;;WAPLICACIONES;ALEJANDRO ARDILA;CERRADO;28/02/2018;;23/04/2018;
28/02/2018;7000001800;WA:SOPORT/MANTE.BD MONITOREO MARZO 2018;;SD-IS;COMERCIAL;SOPORTE TECNOLOGICO;;WAPLICACIONES;ALEJANDRO ARDILA;CERRADO;28/02/2018;;23/04/2018;
28/02/2018;7000001801;WA: NO SE VISUALIZAN ERRORES DESADV ;;SD-IS;COMERCIAL;SOPORTE TECNOLOGICO;;WAPLICACIONES;ALEJANDRO ARDILA;DESARROLLO CONSULTORIA;;;;
01/03/2018;7000001802;AJUSTE REPORTE EFECTIVO UIAF ;;BC-ABA;ADMINISTRATIVA;CUMPLIMIENTO;JHON MORENO ;N2N BUSINESS SOLUTIONS S.A.S;HANSEL DAVID ESPINOZA;CERRADO;01/03/2018;;11/04/2018;
01/03/2018;7000001803;INGRESOS Y RETENCIONES 2017 ;SAP;HCM;ADMINISTRATIVA;GESTION HUMANA;;HR SOLUTIONS;HR SOLUTIONS;CERRADO;08/03/2018;;20/03/2018;
02/03/2018;7000001804;CREACION ORDEN DE COMPRA BAPI ;;;COMERCIAL;SOPORTE TECNOLOGICO;ARMANDO BARRERA;INSAP CONSULTORIA ;GIOVNNI LOPEZ URBINA;CERRADO;02/03/2018;;12/07/2018;
02/03/2018;7000001805;WA:ANEXAR COLUMNA ID TRANSFER.MODU.PEDIDOS ;;SD-IS;COMERCIAL;VENTAS;;WAPLICACIONES;ALEJANDRO ARDILA;CERRADO;02/03/2018;;02/04/2018;
02/03/2018;7000001806;INCONSIS. PROGRAMA ZCDSD_RPTCONVENIOSREMI ;SAP;;COMERCIAL;VENTAS;JOHANN BEDOYA;CONSULTORIA ORGANIZACIONAL ;SANDRA MILENA NIÑO;CERRADO;05/03/2018;;15/06/2018;
05/03/2018;7000001810;WA: TRAZABILIDAD ENTREGA DE PEDIDOS;WEB;;;;;WAPLICACIONES;ALEJANDRO ARDILA;DESARROLLO CONSULTORIA;5/3/2018;;;
06/03/2018;7000001811;WA: DIFERENCIA DESCRIPCIÓN MATERIALES ;;SD-IS;COMERCIAL;SOPORTE TECNOLOGICO;;WAPLICACIONES;ALEJANDRO ARDILA;CERRADO;15/03/2018;;06/03/2018;
06/03/2018;7000001812;MODIFICACION SEGMENTO 8020 FACTURA DE VENTA;;;COMERCIAL;SOPORTE TECNOLOGICO;JHON MORENO;INSAP CONSULTORIA ;GIOVNNI LOPEZ URBINA;CERRADO;06/03/2018;;23/05/2018;
06/03/2018;7000001813;INSCRIPCION FTP RECKITT ;WEB;SD-IS;COMERCIAL;SOPORTE TECNOLOGICO;;WAPLICACIONES;ALEJANDRO ARDILA;DESARROLLO CONSULTORIA;06/03/2018;;;
07/03/2018;7000001814;NUEVA SEDE PEREIRA ;;;COMERCIAL;SOPORTE TECNOLOGICO;ARMANDO BARRERA;ANA JIMENA RODAS;ANA JIMENA RODAS;VALIDACION PRD;;;;acta de cierre 04/07/2018 desde 22/06/2018 
07/03/2018;7000001815;EWM_AJUSTES SALIDAS DE CONVENIOS ;WEB;SD-IS;PROYECTO EWM;PROYECTO EWM;;;PROYECTO EWM;DESARROLLO CONSULTORIA;07/03/2018;;;Se encuentra configurado para Bello y Pereira. El requerimiento se cierra una vez este configurado para todas las regionales en EWM.
07/03/2018;7000001816;NUEVO PLAN MANEJO PRODUCTOS ALTO COSTO ;;;COMERCIAL;SOPORTE TECNOLOGICO;;SIN ASIGNAR;SIN ASIGNAR;NUEVO;;;;
07/03/2018;7000001817;PARAMETRIZACION INDICADOR CME 8;SAP;FI-BL-IS;CONTRALORIA;CARTERA;DOLY TRIANA;APM CONSULTING S.A.S.;ANGELA CARIDAD PIÑERO MORA;CERRADO;07/03/2018;;22/03/2018;
07/03/2018;7000001818;WA: NO SE VISUALIZA PLAN MSF ;;SD-IS;COMERCIAL;SOPORTE TECNOLOGICO;;WAPLICACIONES;ALEJANDRO ARDILA;CERRADO;07/03/2018;;11/04/2018;
07/03/2018;7000001819;INSCRIPCION FTP SOPHIA;WEB;;;;;WAPLICACIONES;ALEJANDRO ARDILA;DESARROLLO CONSULTORIA;5/3/2018;;;
07/03/2018;7000001820;PLANILLAS DE CORRECCION PILA ;SAP;HCM;ADMINISTRATIVA;GESTION HUMANA;YULI JIMENEZ;HR SOLUTIONS;HR SOLUTIONS;PRUEBAS QAS;07/03/2018;;;Se solicita indicaciones de la OT antes de escalar a Sap. Se recomienda escalar el incidente a Sap, ya que la actualización de los “Atributos” y “Tipos de atributos HR” para las subaplicaciones HR son estándar.
08/03/2018;7000001821;NO SE VISUALIZA PLAN MAX ;WEB;;COMERCIAL;SOPORTE TECNOLOGICO;;WAPLICACIONES;ALEJANDRO ARDILA;CERRADO;16/03/2018;;14/03/2018;
12/03/2018;7000001825;ADICIONAR COLUMNA TX ZREGISTROS_INVIMA ;SAP;;COMERCIAL;MARCAS PROPIAS;SONIA SANTIAGO;N2N BUSINESS SOLUTIONS S.A.S;HANSEL DAVID ESPINOZA;CERRADO;28/03/2018;;25/06/2018;
12/03/2018;7000001826;EF-EWM -MM-05 AJUSTE PROGRAMA CREACION ENTREGA ;;;PROYECTO EWM;PROYECTO EWM;ARMANDO BARRERA;;PROYECTO EWM;DESARROLLO CONSULTORIA;26/03/2018;;;Pdt. Validaciones en dev prima del Jose
12/03/2018;7000001827;EWM_AJUSTE CARGUE PEDIDOS VENTAS SIP_SAP ;;SD-IS;PROYECTO EWM;PROYECTO EWM;;;PROYECTO EWM;DESARROLLO CONSULTORIA;09/04/2018;;;Pdt. Validaciones en dev prima del Usuario 
12/03/2018;7000001828;EWM_AJUSTE CARGUE PEDIDOS CONVENIOS ;WEB;SD-IS;PROYECTO EWM;PROYECTO EWM;MARIO CASTRO;;PROYECTO EWM;DESARROLLO CONSULTORIA;27/04/2018;;;PRUEBAS Y AJUSTES Giovanni / aún no he logrado que me cargue el pedido de convenios en el ambiente 700DEVPrima, de acuerdo a lo que entiendo en el debug
13/03/2018;7000001829;ERROR REPORTE SEMANAS FERIALES LIQUIDACION ;BO;BO;COMERCIAL;SOPORTE TECNOLOGICO;PEDRO SANCHEZ;CONSULTORIA ORGANIZACIONAL ;RAUL AMAYA;CERRADO;13/03/2018;;15/05/2018;
14/03/2018;7000001830;WA:ERROR DESCARGA EXCEL SEMANAS FERIALES;;SD-IS;COMERCIAL;SOPORTE TECNOLOGICO;;WAPLICACIONES;ALEJANDRO ARDILA;CERRADO;14/03/2018;;11/04/2018;
14/03/2018;7000001831;VENTAS REGIONAL TOP 500 ;SAP;;COMERCIAL;FARMACENTER;HAROLD RODRIGUEZ;N2N BUSINESS SOLUTIONS S.A.S;HANSEL DAVID ESPINOZA;PRUEBAS QAS;14/03/2018;;;pruebas de QAS del Usuario
15/03/2018;7000001832;CARTERA POR SUMINISTRO MERCANCIA NIF;SAP;FI-BL-IS;GENERAL;COSTOS Y PRESUPUESTOS;MARISOL ARIAS;APM CONSULTING S.A.S.;ANGELA CARIDAD PIÑERO MORA;DESARROLLO CONSULTORIA;28/03/2018;;;Pdt. Validaciones y entref¿ga de parte 1 CONSULTOR ABAP Sandra 
15/03/2018;7000001833;ERROR PROGRAMA ZCDMM_GESTION_ALMACENES_E;SAP;;COMERCIAL;SOPORTE TECNOLOGICO;;N2N BUSINESS SOLUTIONS S.A.S;HANSEL DAVID ESPINOZA;CERRADO;23/03/2018;;22/03/2018;
15/03/2018;7000001834;WA:ERROR ARCHIVO CATALOGO PRODUCTOS ;;SD-IS;COMERCIAL;VENTAS;;WAPLICACIONES;ALEJANDRO ARDILA;CERRADO;16/03/2018;;03/04/2018;
16/03/2018;7000001835;INSCRIPCION FTP CERESCOS ;WEB;SD-IS;COMERCIAL;SOPORTE TECNOLOGICO;;WAPLICACIONES;ALEJANDRO ARDILA;DESARROLLO CONSULTORIA;16/03/2018;;;
16/03/2018;7000001836;WA: TIPOS DE RESPUESTAS FTP.TXT;WEB;SD-IS;COMERCIAL;VENTAS;;WAPLICACIONES;ALEJANDRO ARDILA;DESARROLLO CONSULTORIA;16/03/2018;;;
16/03/2018;7000001837;WA: ERROR AUTORIZACION APP PROVEEDOR ;;SD-IS;COMERCIAL;SOPORTE TECNOLOGICO;;WAPLICACIONES;ALEJANDRO ARDILA;CERRADO;20/03/2018;;16/03/2018;
16/03/2018;7000001838;WA: AJUSTES CLASIFICADOS Y BUSCADOR INTRANET;;SD-IS;GENERAL;COMUNICACIONES;;WAPLICACIONES;ALEJANDRO ARDILA;DESARROLLO CONSULTORIA;16/03/2018;;;Pendiente propuesta comercial
17/03/2018;7000001839;EWMMBB;;;PROYECTO EWM;PROYECTO EWM;SIN USUARIO;SIN ASIGNAR;SIN ASIGNAR;ANULADO;ANULADO;ANULADO;ANULADO;Tambien trabajado por Miguel Escobar
20/03/2018;7000001840;IN: VALIDACION FUNCIONALIDAD PAGINADORES ;;SD-IS;COMERCIAL;MARCAS PROPIAS;;;Interfaces ;CERRADO;23/03/2018;;22/03/2018;
20/03/2018;7000001842;PAG WEB CORPIDROGUISTA;WEB;;DESARROLLO EMPRESARIAL;RECREACIÓN Y DEPORTES;;WAPLICACIONES;ALEJANDRO ARDILA;DESARROLLO CONSULTORIA;;;;Pendiente alcance requerimiento Daniel Quevedo
20/03/2018;7000001843;ERROR LIQUIDACION CESANTIAS ;SAP;HCM;ADMINISTRATIVA;GESTION HUMANA;YULI JIMENEZ;HR SOLUTIONS;HR SOLUTIONS;DESARROLLO CONSULTORIA;20/03/2018;;;Validaciones  / Yuly 04/05/2018
20/03/2018;7000001844;EWM_IMPRESION PLANILLAS REGIONALES ;WEB;SD-IS;PROYECTO EWM;PROYECTO EWM;WILTER CASTRO;;PROYECTO EWM;PRUEBAS QAS;12/04/2018;;;PRUEBAS Y AJUSTES ABAP/ GIOVANNI 
20/03/2018;7000001845;EWM_REIMPRESION PLANILLAS ;WEB;SD-IS;PROYECTO EWM;PROYECTO EWM;WILTER CASTRO;;PROYECTO EWM;DESARROLLO CONSULTORIA;;;;PRUEBAS Y AJUSTES ABAP/ GIOVANNI 10/07/2018
20/03/2018;7000001846;EWM_CARGUE ORDENES VENTA CONVENIOS ;WEB;SD-IS;PROYECTO EWM;PROYECTO EWM;;;PROYECTO EWM;DESARROLLO CONSULTORIA;;;;PRUEBAS Y AJUSTES ABAP/ GIOVANNI 26/06/2018 desde el 20/03/2018
20/03/2018;7000001847;EWM_FACTURA VENTA CONVENISO ;WEB;SD-IS;PROYECTO EWM;PROYECTO EWM;;;PROYECTO EWM;DESARROLLO CONSULTORIA;;;;Validacion por el Usuario AJUSTES EN DEV PRIMA DE  JIMENA a GIOVANI 07/06/2018/ Solicitud de estado de Requerimiento 26/06/2018.
20/03/2018;7000001848;WA: FACTURAS REPETIDAS ;;SD-IS;CONTRALORIA;CARTERA;;WAPLICACIONES;ALEJANDRO ARDILA;CERRADO;20/03/2018;;03/04/2018;
20/03/2018;7000001849;WA: CREACION PROVEEDOR CONVENIOS ;;SD-IS;COMERCIAL;SOPORTE TECNOLOGICO;;WAPLICACIONES;ALEJANDRO ARDILA;CERRADO;20/03/2018;;03/04/2018;
21/03/2018;7000001850;AJUSTE PROGRAMA ZCDSD_BAPIVA02 ;;;COMERCIAL;SOPORTE TECNOLOGICO;ARMANDO BARRERA;INSAP CONSULTORIA ;GIOVNNI LOPEZ URBINA;CERRADO;21/03/2018;;12/07/2018;
21/03/2018;7000001851;NUEVAS NOTAS SAP FEBRERO ;SAP;HCM;ADMINISTRATIVA;GESTION HUMANA;YULI JIMENEZ;HR SOLUTIONS;HR SOLUTIONS;DESARROLLO CONSULTORIA;21/03/2018;;;Pendiente respuesta Don Ricardo  03/05/2018 no se tiene respuesta  desde el 28/03/2018
21/03/2018;7000001852;NUEVO BOLETIN SAP FEBRERO SEMANA 2;SAP;HCM;ADMINISTRATIVA;GESTION HUMANA;YULI JIMENEZ;HR SOLUTIONS;HR SOLUTIONS;PENDIENTE DEFINICION;21/03/2018;;;Pendiente respuesta Don Ricardo 03/05/2018 no se tiene respuesta  desde el 28/03/2018
21/03/2018;7000001853;WA: AJUSTE PAGINA WEB FARMAEXPRESS;WEB;SD-IS;COMERCIAL;MERCADEO;;WAPLICACIONES;ALEJANDRO ARDILA;DESARROLLO CONSULTORIA;21/03/2018;;;Pruebas usuario
21/03/2018;7000001854;CAMPO NUEVO MAESTRO DE CLIENTES ;WEB;;COMERCIAL;SOPORTE TECNOLOGICO;ANDERSON CARDENAS;INSAP CONSULTORIA ;GIOVNNI LOPEZ URBINA;PENDIENTE PASO PRD;21/03/2018;;;Pendiente autorización de paso PRD Dirección de Soporte
22/03/2018;7000001855;ESCENARIOS PU ENTRADA DE MERCANCIA 1;WEB;SD-IS;PROYECTO EWM;PROYECTO EWM;;;PROYECTO EWM;DESARROLLO CONSULTORIA;;;;Jose/ Solicitud de estado de requerimiento 26/06/2018
22/03/2018;7000001856;MODIFICACION LIQUIDACION DE APORTES;SAP;HCM;ADMINISTRATIVA;GESTION HUMANA;YULI JIMENEZ;HR SOLUTIONS;HR SOLUTIONS;VALIDACION PRD;22/03/2018;;;Validaciones PRD / Yuly 03/05/2018
23/03/2018;7000001857;WA: SIP SOPORTE;;SD-IS;COMERCIAL;VENTAS;;WAPLICACIONES;ALEJANDRO ARDILA;DESARROLLO CONSULTORIA;23/03/2018;;;Pendiente desarrollo SAP req. 7000002001
23/03/2018;7000001858;WA: NOMBRE VENDEDOR AUTOMATICO EN HISTORICO ;;SD-IS;CONTRALORIA;CARTERA;;WAPLICACIONES;ALEJANDRO ARDILA;CERRADO;23/03/2018;;02/04/2018;
23/03/2018;7000001859;WA: MADOFI. MAXIMO X PEDIDO SIP ADMINISTRADOR ;;SD-IS;COMERCIAL;VENTAS;;WAPLICACIONES;ALEJANDRO ARDILA;DESARROLLO CONSULTORIA;23/03/2018;;;Pendiente propuesta comercial
23/03/2018;7000001860;AJUSTE TRANSACCION ZRPT_FLUJO_PEDIDOS;SAP;;COMERCIAL;VENTAS;SANDRA URIBE;N2N BUSINESS SOLUTIONS S.A.S;HANSEL DAVID ESPINOZA;CERRADO;23/03/2018;;19/04/2018;
23/03/2018;7000001861;WA: MENSAJE INFORMATIVO PROVEEDORES - ASOCIADOS ;;SD-IS;COMERCIAL;VENTAS;;WAPLICACIONES;ALEJANDRO ARDILA;DESARROLLO CONSULTORIA;23/03/2018;;;Pendiente propuesta comercial
23/03/2018;7000001862;CAMBIO CUENTA BANCARIA Y FACTURA DE VENTA;SAP;;NTI;CONTABILIDAD – NTI;DEISY MUÑOZ;CONSULTORIA ORGANIZACIONAL ;SANDRA MILENA NIÑO;CERRADO;23/03/2018;;27/03/2018;Tambien trabajado por Giovanni Lopez
23/03/2018;7000001863;PARAMETRIZACION INDICADOR CME H CUENTA 164502056 ;SAP;FI-BL-IS;CONTRALORIA;CARTERA;DOLY TRIANA;APM CONSULTING S.A.S.;ANGELA CARIDAD PIÑERO MORA;CERRADO;23/03/2018;;21/08/2018;
24/03/2018;7000001864;SALTO DE CONSECUTIVOS EN FACTURAS DE VENTAS;SAP;;NTI;CONTABILIDAD – NTI;;ANA JIMENA RODAS;ANA JIMENA RODAS;DESARROLLO CONSULTORIA;;;;No se ha iniciado por prioridad. Actualmente prioridad EWM.
26/03/2018;7000001865;NUEVAS NOTAS SAP;SAP;HCM;ADMINISTRATIVA;GESTION HUMANA;YULI JIMENEZ;HR SOLUTIONS;HR SOLUTIONS;DESARROLLO CONSULTORIA;;;;Pendiente respuesta Don Ricardo  03/05/2018 no se tiene respuesta desde el 26/03/2018 paso QAS de las notas
27/03/2018;7000001866;WA:AJUSTE CONSECUTIVO EN MÓDULOS SIP;WEB;;COMERCIAL;MERCADEO;;WAPLICACIONES;ALEJANDRO ARDILA;CERRADO;27/03/2018;;18/04/2018;
27/03/2018;7000001867;WA:RED PRODUCTOS NO ENCONTRADOS;WEB;;COMERCIAL;MERCADEO;;WAPLICACIONES;ALEJANDRO ARDILA;CERRADO;27/03/2018;;27/04/2018;
27/03/2018;7000001868;REVISIÓN DE LA PARAMETRIZACIÓN DEL REPORTE S_EB5_05000741;SAP;FI;CONTRALORIA;CONTABILIDAD;;APM CONSULTING S.A.S.;ANGELA CARIDAD PIÑERO MORA;CERRADO;28/03/2018;;04/04/2018;
27/03/2018;7000001869;IMPLEMENTACIÓN CENTRO 2200 PEREIRA;;;COMERCIAL;SOPORTE TECNOLOGICO;ARMANDO BARRERA;INSAP CONSULTORIA ;GIOVNNI LOPEZ URBINA;CERRADO;27/03/2018;;04/07/2018;
28/03/2018;7000001870;ERROR APLICACION NOTA 2546852;SAP;HCM;ADMINISTRATIVA;GESTION HUMANA;;HR SOLUTIONS;HR SOLUTIONS;DESARROLLO CONSULTORIA;28/03/2018;;;Pendiente respuesta Don Ricardo 18/05/2018
28/03/2018;7000001871;WA: ERROR ARCHIVO OBS. BOLETÍN VIRTUAL;WEB;;COMERCIAL;SOPORTE TECNOLOGICO;;WAPLICACIONES;ALEJANDRO ARDILA;CERRADO;28/03/2018;;03/04/2018;
28/03/2018;7000001872;WA:ADMON PAG/WEB YAPLICACIONES ENE 2018;WEB;;COMERCIAL;SOPORTE TECNOLOGICO;HENRY RODRIGUEZ;WAPLICACIONES;ALEJANDRO ARDILA;CERRADO;28/03/2018;;09/05/2018;
28/03/2018;7000001873;WA:SOPORT/MANTEN. BD MONITOREO ENE-2018;WEB;;COMERCIAL;SOPORTE TECNOLOGICO;HENRY RODRIGUEZ;WAPLICACIONES;ALEJANDRO ARDILA;CERRADO;28/03/2018;;09/05/2018;
02/04/2018;7000001875;SERVIDORES DE BO  A NIVEL DE DEV Y PRD;BO;;PROYECTO BO;PROYECTO BO;DAVID MONTOYA;CONSULTORIA ORGANIZACIONAL ;RAUL AMAYA;VALIDACION PRD;02/04/2018;;;PDT DON HENRYJesús Guerreros envía correo con el informe técnico del diagnóstico adjunto
03/04/2018;7000001876;INSCRIPCIÓN  FTP LAFRANCOL S.A.;WEB;;COMERCIAL;SOPORTE TECNOLOGICO;;WAPLICACIONES;ALEJANDRO ARDILA;DESARROLLO CONSULTORIA;03/04/2018;;;
03/04/2018;7000001877;EWM: IMPRESIÓN FACTURAS;;;PROYECTO EWM;PROYECTO EWM;WILTER CASTRO;;PROYECTO EWM;DESARROLLO CONSULTORIA;03/04/2018;;;Pdt. Validaciones en dev prima del Usuario 
03/04/2018;7000001878;EWM: IMPRESIÓN ACTA DE TRAZABILIDAD;SAP;;PROYECTO EWM;PROYECTO EWM;WILTER CASTRO;;PROYECTO EWM;DESARROLLO CONSULTORIA;03/04/2018;;;Pdt. Validaciones en dev prima del Usuario 
03/04/2018;7000001879;EWM: GENERACIÓN INFORMACIÓN ARCHIVO POS;;;PROYECTO EWM;PROYECTO EWM;WILTER CASTRO;;PROYECTO EWM;DESARROLLO CONSULTORIA;03/04/2018;;;Pdt. Validaciones en dev prima del Usuario 
03/04/2018;7000001880;PUESTA EN MARCHA VOCOLLECT PEREIRA 2 ;SAP;;COMERCIAL;SOPORTE TECNOLOGICO;JHON MORENO ;NET LOGISTICK;NET LOGISTICK;PENDIENTE DOCUMENTACIÓN TECNICA;03/04/2018;;;Pdt. DT NET LogisticJhon Moreno
03/04/2018;7000001881; DEVOLUCION APORTE A PENSIÓN ;SAP;HCM;ADMINISTRATIVA;GESTION HUMANA;YULI JIMENEZ;HR SOLUTIONS;HR SOLUTIONS;PRUEBAS QAS;03/04/2018;;;"se pasa OT a QAS PARA PRUEBAS, pero  La orden DEVK935585, fue transportada pero arrojó un error ""8"", al parecer faltan unos objetos que son dependientes de dicha orden."
04/04/2018;7000001882;WA: INFORMES PARA PREASOCIADOS;WEB;;DESARROLLO EMPRESARIAL;TRADE MARKETING;;WAPLICACIONES;ALEJANDRO ARDILA;DESARROLLO CONSULTORIA;;;;Pendiente paso a prd y DT
06/04/2018;7000001883;WA: ARCHIVOS DE RESPUESTA EN BLANCO;WEB;;COMERCIAL;SOPORTE TECNOLOGICO;;WAPLICACIONES;ALEJANDRO ARDILA;CERRADO;05/04/2018;;18/04/2018;
06/04/2018;7000001884;PRODUCTOS EQUIVALENTES;SAP;;COMERCIAL;SOPORTE TECNOLOGICO;ANDERSON CARDENAS;CONSULTORIA ORGANIZACIONAL ;SANDRA MILENA NIÑO;CERRADO;06/04/2018;;07/06/2018;
07/04/2018;7000001885;MODIFICACION RESOLUCION FACTURA;WEB;;CONTRALORIA;IMPUESTOS;ARMANDO BARRERA;INSAP CONSULTORIA ;GIOVNNI LOPEZ URBINA;PENDIENTE DOCUMENTACIÓN TECNICA;15/06/2018;;;el usuario directamente en el sistema PRD, el usuario que realizo la actividad fue Armando Barrera Guzman, por esta razón el requerimiento se debe validar y solicitar el cierre del mismo directamente 
09/04/2018;7000001890;PROCESO DE IMPRESIÓN DE DOCUMENTOS DE SALIDA MERCANCÍAS / MB02;;;COMERCIAL;SOPORTE TECNOLOGICO;ARMANDO BARRERA;INSAP CONSULTORIA ;GIOVNNI LOPEZ URBINA;CERRADO;09/04/2018;;12/07/2018;
09/04/2018;7000001891;EF-EWM -MM-06 LOTE PROVEEDOR ENTREGA ENTRANTE;;;PROYECTO EWM;PROYECTO EWM;ARMANDO BARRERA;;PROYECTO EWM;DESARROLLO CONSULTORIA;09/04/2017;;;Las ordenes de transporte generadas para este requerimiento son la creadas por la consultoría ABAP asignada. Una vez se defina la conformación de los ambientes QAS y PRD integrados a EWM se debe hacer la aplicación de la ordenes de transporte según la definición de la consultoría ABAP
09/04/2018;7000001892;REPORTE UGPP;SAP;HCM;ADMINISTRATIVA;GESTION HUMANA;YULI JIMENEZ;HR SOLUTIONS;HR SOLUTIONS;PRUEBAS QAS;09/04/2018;;;Envío el documento con los acumuladores, y el instructivo de la plantilla de nómina que se requiere para el informe de la UGPP 
09/04/2018;7000001893;CÓDIGOS DE BARRAS POR MATERIAL;SAP;;COMERCIAL;SOPORTE TECNOLOGICO;FABIAN SANCHEZ;N2N BUSINESS SOLUTIONS S.A.S;HANSEL DAVID ESPINOZA;CERRADO;09/04/2017;;09/05/2018;
10/04/2018;7000001894;WA: ERROR VISUALIZACIÓN HISTÓRICO PLAN MAX;WEB;;COMERCIAL;SOPORTE TECNOLOGICO;;WAPLICACIONES;ALEJANDRO ARDILA;CERRADO;10/04/2018;;27/04/2018;
10/04/2018;7000001895;ERROR CONTABILIZACIÓN DE DEVOLUCIONES ICOM;;;COMERCIAL;SOPORTE TECNOLOGICO;ARMANDO BARRERA;JOSE MACIAS CHACON;JOSE MACIAS CHACON;PENDIENTE DOCUMENTACIÓN TECNICA;;;;DT / Jose   para cerrar 26/06/2018 desde el 19/04/2018
10/04/2018;7000001896;WA: LOGS APLICATIVO REVISIÓN DE PEDIDOS CEDIS;WEB;;COMERCIAL;SOPORTE TECNOLOGICO;;WAPLICACIONES;ALEJANDRO ARDILA;CERRADO;10/04/2018;;12/04/2018;
10/04/2018;7000001897;WA: ACTUALIZACIÓN MATERIALES;WEB;;COMERCIAL;SOPORTE TECNOLOGICO;;WAPLICACIONES;ALEJANDRO ARDILA;CERRADO;10/04/2018;;11/04/2018;
10/04/2018;7000001898;ZFI_APLIC_RECAUDOS;;;CONTRALORIA;CARTERA;DOLY TRIANA;SIN ASIGNAR;SIN ASIGNAR;CERRADO;;;17/04/2018;
11/04/2018;7000001899;WA:VERIFICACIÓN PROCESO DE EJECUCIÓN ARCHIVOS FTP CONVENIOS;WEB;;COMERCIAL;SOPORTE TECNOLOGICO;;WAPLICACIONES;ALEJANDRO ARDILA;CERRADO;11/04/2018;;12/04/2018;
