28/12/2016;7000001131;IMPLEMENTAR EL CONTROL DEL EAN 14 EN R-M;SAP;MM-IS;COMERCIAL;SOPORTE TECNOLOGICO;;SIN ASIGNAR;SIN ASIGNAR;NUEVO;;;;Definir fecha de reunion con Sr, Mauricio - Dr Espitia para presentacion de impacto del proceso de Getin 14
28/12/2016;7000001132;WA: CREACION RUTINA SSH CARGE INVENTARIO;SAP;SD-IS;COMERCIAL;VENTAS;;WAPLICACIONES;ALEJANDRO ARDILA;CERRADO;02/01/2017;;;
30/12/2016;7000001133;ESTRUCTURA MCSI S934 Y S935 - 2017;WEB;FI-BL-IS;CONTRALORIA;CARTERA;;;;CERRADO;04/01/2017;;;
02/01/2017;7000001135;WA: AJUSTES PAGINA WEB - ENERO;WEB;SD-IS;COMERCIAL;SOPORTE TECNOLOGICO;;;;CERRADO;01/02/2017;;18/02/2017;
03/01/2017;7000001136;INDICADOR DE IMPOCONSUMO;WEB;FI-BL-IS;CONTRALORIA;IMPUESTOS;;;;CERRADO;04/01/2017;;07/01/2017;
05/01/2017;7000001137;ACTUALIZACIÓN SUBSIDIO DE TRANSPORTE Y SALARIO MINIMO;SAP;PA-PA-CO;ADMINISTRATIVA;GESTION HUMANA;;;;CERRADO;10/01/2017;;06/01/2017;
05/01/2017;7000001138;WA: TAREA AUTOMATICA TRANSFEREN PROD DES;SAP;SD-IS;COMERCIAL;VENTAS;;WAPLICACIONES;ALEJANDRO ARDILA;CERRADO;07/01/2017;;18/03/2017;
05/01/2017;7000001139;NOTA ACTUALIZACION DE CONSTANTES 2017;WEB;PA-PA-CO;ADMINISTRATIVA;GESTION HUMANA;;;;CERRADO;20/01/2017;;12/01/2017;
07/01/2017;7000001140;WA: SEPARACION SERVIDORES - APLICACIONES;SAP;SD-IS;COMERCIAL;SOPORTE TECNOLOGICO;;WAPLICACIONES;ALEJANDRO ARDILA;CERRADO;11/01/2017;;21/07/2017;
10/01/2017;7000001145;CREACIÓN INDICADORES RETENCIÓN ICA - COTA ;SAP;FI-BL-IS;CONTRALORIA;IMPUESTOS;;;;CERRADO;13/01/2017;;27/01/2017;Se solicito confirmación de cierre el 27/01/2017, se da por cerrado de acuerdo al procedimiento
11/01/2017;7000001146;CREACION DE RANGO DE CUENTAS PARA DESGLO;VOCOLLECT;FI-BL-IS;CONTRALORIA;CONTABILIDAD;;APM CONSULTING S.A.S.;ANGELA CARIDAD PIÑERO MORA;CERRADO;14/01/2017;;16/02/2017;
13/01/2017;7000001147;AJUSTE REPORTE DE RESUMEN DE TRANSFERENC;WEB;SD-IS;COMERCIAL;VENTAS;;INSAP CONSULTORIA ;GIOVNNI LOPEZ URBINA;CERRADO;20/01/2017;;09/03/2017;
13/01/2017;7000001148;CREACIÓN RUTAS Y ZONAS DE REMESAS;WEB;SD-IS;COMERCIAL;VENTAS;ASTRID MILA;ANA JIMENA RODAS;ANA JIMENA RODAS;CERRADO;14/01/2017;;;
14/01/2017;7000001149;ERROR CONTABILIZACION NOMINA ENE 2017;SAP;PA-PA-CO;ADMINISTRATIVA;GESTION HUMANA;;COOPIDROGAS;ARMANDO BARRERA;CERRADO;20/01/2017;;14/01/2018;
16/01/2017;7000001150;ERROR INGRESO FLUCONAZOL O.P. 930000119;SAP;MM-IS;CONTRALORIA;PLANTA ALCOHOL;;;;CERRADO;18/01/2017;;;
17/01/2017;7000001151;ERROR ZFIFACT;SAP;SD-IS;COMERCIAL;SOPORTE TECNOLOGICO;;;;CERRADO;17/01/2017;;;
17/01/2017;7000001152;WA: ENCUESTA CONTINUIDAD DE NEGOCIO;WEB;SD-IS;ADMINISTRATIVA;ORGANIZACIÓN Y METODOS;;WAPLICACIONES;ALEJANDRO ARDILA;CERRADO;18/01/2017;;;
18/01/2017;7000001153;AJUSTES PLANO TELEFEREIAS;SAP;SD-IS;COMERCIAL;VENTAS;;;;CERRADO;05/05/2017;;;
18/01/2017;7000001154;WA: AMPLIACION CROSSELLING SIP PROVEEDORES;WEB;SD-IS;COMERCIAL;VENTAS;;WAPLICACIONES;ALEJANDRO ARDILA;CERRADO;18/01/2017;;;
18/01/2017;7000001155;MODIFI. DATOS MAESTROS ACTIVOS FIJOS;SAP;FI-BL-IS;ADMINISTRATIVA;SERVICIOS GENERALES;;COOPIDROGAS;DIANA SANCHEZ;CERRADO;30/01/2017;;;DIA A DIA
18/01/2017;7000001156;REVISION EXTRACTOS;SAP;FI-BL-IS;CONTRALORIA;CONTABILIDAD;;;;CERRADO;18/01/2017;;;
18/01/2017;7000001157;HCM: FALLA VANCANTES MODULO OM;SAP;HCM;ADMINISTRATIVA;GESTION HUMANA;;HR SOLUTIONS;HR SOLUTIONS;CERRADO;18/01/2017;;;
18/01/2017;7000001158;WA: AJUSTES POLLA 2017;WEB;SD-IS;COMERCIAL;MERCADEO;;WAPLICACIONES;ALEJANDRO ARDILA;CERRADO;18/01/2017;;;
18/01/2017;7000001159;WA: PEDIDOS POR CENTRO FASE II;SAP;SD-IS;COMERCIAL;VENTAS;;WAPLICACIONES;ALEJANDRO ARDILA;CERRADO;18/01/2017;;;
19/01/2017;7000001160;IN:MODIFICACION AGENCIA VIRTUAL MODULO  FARMACENTER;;SD-IS;COMERCIAL;FARMACENTER;;WAPLICACIONES;ALEJANDRO ARDILA;CERRADO;20/01/2017;;;
20/01/2017;7000001161;ERROR SELECCION DE MATERIALES;SAP;MM-IS;CONTRALORIA;PLANTA ALCOHOL;;;;CERRADO;23/01/2017;;;
20/01/2017;7000001162;CREACION PROVEEDORES;SAP;SD-IS;COMERCIAL;COMPRAS;;;;CERRADO;20/01/2017;;;
23/01/2017;7000001165;ERROR CONTIBILIZACIONES ICOM;SAP;MM-IS;COMERCIAL;MARCAS PROPIAS;;;;CERRADO;24/01/2017;;;
23/01/2017;7000001166;ERROR CARGUE CONVENIOS;SAP;SD-IS;COMERCIAL;VENTAS;;;;CERRADO;23/01/2017;;;
23/01/2017;7000001167;CREACION INDICADORES - PAGOS AL EXTERIOR;SAP;FI-BL-IS;CONTRALORIA;IMPUESTOS;;;;CERRADO;24/01/2017;;;
24/01/2017;7000001168;CREACION CUENTAS;SAP;FI-BL-IS;CONTRALORIA;CONTABILIDAD;;;;CERRADO;24/01/2017;;;
24/01/2017;7000001169;CREACIÓN GRUPO DE VENDEDORES;WEB;SD-IS;COMERCIAL;VENTAS;;;;CERRADO;24/01/2017;;;
24/01/2017;7000001170;INCONSISTENCIA VERIFACION  FACTURAS;SAP;MM-IS;COMERCIAL;SOPORTE TECNOLOGICO;;;;CERRADO;25/01/2017;;;
24/01/2017;7000001171;WA: INTEGRACION BO - PLAN RETO;WEB;SD-IS;COMERCIAL;VENTAS;;WAPLICACIONES;ALEJANDRO ARDILA;CERRADO;25/01/2017;;;
25/01/2017;7000001172;WA: MICROSITIO FARMACENTER;WEB;SD-IS;COMERCIAL;FARMACENTER;;WAPLICACIONES;ALEJANDRO ARDILA;CERRADO;27/01/2017;;;
25/01/2017;7000001173;INCREMENTO 8% BON.COMISI-AUXILIOS ALIMEN;WEB;PA-PA-CO;ADMINISTRATIVA;GESTION HUMANA;;;;CERRADO;27/01/2017;;;
26/01/2017;7000001174;NOTIFICACION CAMBIOS DE EMBALAJES GV;SAP;MM-IS;COMERCIAL;COMERCIAL;SIN USUARIO;SIN ASIGNAR;SIN ASIGNAR;ANULADO ;ANULADO;ANULADO;ANULADO;
27/01/2017;7000001175;CAMPO MAESTRO MATERIALES ZOBS;;SD-IS;COMERCIAL;VENTAS;;;;CERRADO;29/01/2017;;;
27/01/2017;7000001176;WA: PRODUCTOS SIN INVENTARIO PROVENIENTES DE TRANSFERENCIA;WEB;SD-IS;COMERCIAL;VENTAS;;WAPLICACIONES;ALEJANDRO ARDILA;CERRADO;27/01/2017;;;
27/01/2017;7000001177;FACTURACION OTROS COBROS 5% IVA;WEB;SD-IS;COMERCIAL;SOPORTE TECNOLOGICO;;;;CERRADO;30/01/2017;;;
30/01/2017;7000001180;ACTULIZACION INDICADORES ZFIVENTASDROG;SAP;FI-BL-IS;CONTRALORIA;CONTABILIDAD;;;;CERRADO;30/01/2017;;;
30/01/2017;7000001181;WA: SIP ASOCIADOS-VENDEDORES;WEB;SD-IS;COMERCIAL;VENTAS;SIN USUARIO;WAPLICACIONES;ALEJANDRO ARDILA;ANULADO;01/02/2017;ANULADO;ANULADO;
30/01/2017;7000001182;WA: CASOS SIP TRANSFERENCIAS;WEB;SD-IS;COMERCIAL;VENTAS;SIN USUARIO;WAPLICACIONES;ALEJANDRO ARDILA;ANULADO;01/02/2017;ANULADO;ANULADO;
30/01/2017;7000001183;ACTUALIZACION VALOR UVT AÑO 2017;SAP;FI-BL-IS;ADMINISTRATIVA;SERVICIOS GENERALES;;;;CERRADO;01/02/2017;;;
01/02/2017;7000001184;CIERRE MES ACTIVOS FIJOS;WEB;FI-BL-IS;ADMINISTRATIVA;SERVICIOS GENERALES;;;;CERRADO;13/02/2017;;;
01/02/2017;7000001185;CREAR INDICADOR IVA DESCONTABLE SOC 1000;SAP;FI-BL-IS;CONTRALORIA;IMPUESTOS;SIN USUARIO;APM CONSULTING S.A.S.;ANGELA CARIDAD PIÑERO MORA;ANULADO ;ANULADO;ANULADO;ANULADO;
01/02/2017;7000001186;HISTORICO DE PRECIOS CONVENIOS;SAP;SD-IS;COMERCIAL;VENTAS;;;;CERRADO;02/02/2017;;;
01/02/2017;7000001187;ERROR CONTABILIZACION NTI - CEBE;WEB;PA-PA-CO;ADMINISTRATIVA;GESTION HUMANA;;;;CERRADO;06/02/2017;;;
01/02/2017;7000001188;WA:INTEGRACION WEB SERVICE CAP ABBOTT;SAP;SD-IS;COMERCIAL;VENTAS;;WAPLICACIONES;ALEJANDRO ARDILA;CERRADO;01/02/2017;;;
02/02/2017;7000001189;WA: AJUSTES PAGINA WEB - FEBRERO 2017;SAP;SD-IS;COMERCIAL;SOPORTE TECNOLOGICO;;WAPLICACIONES;ALEJANDRO ARDILA;CERRADO;06/02/2017;;;
03/02/2017;7000001190;ERROR EN TABLA VF04;WEB;SD-IS;COMERCIAL;SOPORTE TECNOLOGICO;;ANA JIMENA RODAS;ANA JIMENA RODAS;CERRADO;06/02/2017;;;
03/02/2017;7000001191;CREAR ALMACENES PARA EL CENTRO M100;SAP;MM-IS;COMERCIAL;MARCAS PROPIAS;;;;CERRADO;07/02/2017;;;
06/02/2017;7000001195;HCM: RETENCION POR SALARIOS;SAP;HCM;ADMINISTRATIVA;GESTION HUMANA;;HR SOLUTIONS;HR SOLUTIONS;CERRADO;06/02/2017;;;
06/02/2017;7000001196;ERROR INF TRANSFEREN  - PEDIDOS NO CARGA;WEB;SD-IS;COMERCIAL;VENTAS;;;;CERRADO;10/02/2017;;;
07/02/2017;7000001197;CONTROL VENTAS CIGARRILLOS Y LICORES;SAP;SD-IS;COMERCIAL;VENTAS;;;;CERRADO;10/02/2017;;;
08/02/2017;7000001198;WA: APLICATIVO REVISION PEDIDOS CEDIS;;SD-IS;COMERCIAL;VENTAS;;WAPLICACIONES;ALEJANDRO ARDILA;CERRADO;03/08/2017;;;
13/02/2017;7000001200;INCONSISTENCIA EN TABLA 09 DE VOCOLLECT;SAP;SD-IS;CONTRALORIA;CEDI – REGIONALES;;INSAP CONSULTORIA ;GIOVNNI LOPEZ URBINA;CERRADO;09/03/2017;;;
13/02/2017;7000001201;RESOLUCION DE LA PILA BOLETIN INFORMATIV;SAP;HCM;ADMINISTRATIVA;GESTION HUMANA;;HR SOLUTIONS;HR SOLUTIONS;CERRADO;15/02/2017;;;
13/02/2017;7000001202;IN: MODIFICACION NUEVA AULA VIRTUAL;WEB;SD-IS;COMERCIAL;MARCAS PROPIAS;;INTERFACES;INTERFACES;CERRADO;14/02/2017;;;
14/02/2017;7000001203;AJUSTE PROG IMPRESION FACTURAS ZTER;WEB;SD-IS;COMERCIAL;SOPORTE TECNOLOGICO;;ANA JIMENA RODAS;ANA JIMENA RODAS;CERRADO;16/02/2017;;;
15/02/2017;7000001204;MODIF - TRANSACCION ZROTACION MAQUILA;SAP;SD-IS;COMERCIAL;MARCAS PROPIAS;JAVIER MURILLO;CONSULTORIA ORGANIZACIONAL ;SANDRA MILENA NIÑO;VALIDACION PRD;15/02/2017;;;Pdt Ajustes del Consultor No está cargando el archivo plano en la aplicación ZFORECAST,la cual alimenta la información que se utiliza en la transacción ZROTACION MAQUILA. 
15/02/2017;7000001205;VERIFICACION  CALCULO DE LOTES - OBSEQUIOS;WEB;SD-IS;CONTRALORIA;CONTRALORIA;;INSAP CONSULTORIA ;GIOVNNI LOPEZ URBINA;CERRADO;16/02/2017;;;
16/02/2017;7000001206;CANT. BONIFICADA EN AVISOS DE DESPACHOS;WEB;SD-IS;COMERCIAL;COMPRAS;;JOSE MACIAS CHACON;JOSE MACIAS CHACON;CERRADO;20/02/2017;;;
16/02/2017;7000001207;CREACION RANGO DE CUENTAS DESGLOCE;SAP - HANA – BO;FI-BL-IS;CONTRALORIA;CONTABILIDAD;;APM CONSULTING S.A.S.;ANGELA CARIDAD PIÑERO MORA;CERRADO;23/02/2017;;;
20/02/2017;7000001210;VALIDACION POSICIONES KIT VIRTUAL – BONIFICACIONES EN ESPECIE;SAP;FI-BL-IS;COMERCIAL;VENTAS;;INSAP CONSULTORIA ;GIOVNNI LOPEZ URBINA;CERRADO;24/02/2017;;;
21/02/2017;7000001211;ACT. INDICADORES DCTO ESPECIAL COMPRAS;SAP;FI-BL-IS;CONTRALORIA;CONTABILIDAD;;INSAP CONSULTORIA ;GIOVNNI LOPEZ URBINA;CERRADO;;;;
21/02/2017;7000001212;ENVIO AUT PROVEED INVENTARIOS Y ROTACION;SAP;MM-IS;COMERCIAL;COMERCIAL;;INSAP CONSULTORIA ;GIOVNNI LOPEZ URBINA;CERRADO;;;;
23/02/2017;7000001213;HCM:CERTIFICADO INGRESOS RETENCION 2016;SAP;;ADMINISTRATIVA;GESTION HUMANA;;;;CERRADO;27/02/2017;;;
23/02/2017;7000001214;PLANEADOR DE TAREAS;;SD-IS;COMERCIAL;MARCAS PROPIAS;SIN USUARIO;SIN EMPRESA;SIN CONSULTOR;ANULADO ;ANULADO;ANULADO;ANULADO;
27/02/2017;7000001215;INCONSISTENCIA CONVENIOS;WEB;SD-IS;COMERCIAL;VENTAS;;N2N BUSINESS SOLUTIONS S.A.S;JORGE QUIROGA;CERRADO;28/02/2017;;;
28/02/2017;7000001216;IN: AJUSTES CEDIS - SEGUN AUDITORIA;SAP;SD-IS;CONTRALORIA;CONTRALORIA ;;INTERFACES;INTERFACES;CERRADO;28/02/2017;;;
28/02/2017;7000001217;REPORTE TRANSFERENCIAS - ZCDSD_REP_TRANSFERE;WEB;SD-IS;COMERCIAL;VENTAS;;PROJECTION CORE;MIGUEL ESCOBAR;CERRADO;22/03/2017;;;
28/02/2017;7000001218;CORRECCION REPORTE DE PROVISIONES VACACIONES;SAP;HCM;ADMINISTRATIVA;GESTION HUMANA;;HR SOLUTIONS;HR SOLUTIONS;CERRADO;02/03/2017;;;
01/03/2017;7000001219;WA: AJUSTES PAGINA WEB - MARZO 2017;SAP;SD-IS;COMERCIAL;SOPORTE TECNOLOGICO;;WAPLICACIONES;ALEJANDRO ARDILA;CERRADO;06/03/2017;;;
01/03/2017;7000001220;HCM:  SUPPORT  PACKAGES 2017;WEB;;ADMINISTRATIVA;GESTION HUMANA;;;;CERRADO;02/03/2017;;;
02/03/2017;7000001221;WA: UNIFICACION FACTURAS FECHA FUTURA;SAP;SD-IS;CONTRALORIA;CARTERA;;WAPLICACIONES;ALEJANDRO ARDILA;CERRADO;06/03/2017;;;
02/03/2017;7000001222;WA: BOLETIN EVOLUCION COMPRAS A COOPIDROGAS;WEB;SD-IS;DESARROLLO EMPRESARIAL;DESARROLLO EMPRESARIAL;;WAPLICACIONES;ALEJANDRO ARDILA;CERRADO;03/03/2017;;;
06/03/2017;7000001225;MODIFICACION DESCUENTOS NTI 2000;WEB;FI-BL-IS;CONTRALORIA;TESORERIA – NTI;;INSAP CONSULTORIA ;GIOVNNI LOPEZ URBINA;CERRADO;08/03/2017;;;
07/03/2017;7000001226;SAP BOLETIN EVOLUCION COMPRAS A COOPIDRO;WEB;SD-IS;DESARROLLO EMPRESARIAL;DESARROLLO EMPRESARIAL;;INSAP CONSULTORIA ;GIOVNNI LOPEZ URBINA;CERRADO;09/03/2017;;;
08/03/2017;7000001227;HCM: ERROR CALCULO SEGURIDAD SOCIAL;SAP;HCM;ADMINISTRATIVA;GESTION HUMANA;;HR SOLUTIONS;HR SOLUTIONS;CERRADO;09/03/2017;;;
09/03/2017;7000001228;SWIFT - COMUNICACION ESTANDARIZADA Y SEGURA EN EL SECTOR FINANCIERO ;WEB;FI-BL-IS;CONTRALORIA;TESORERIA;;;;CERRADO;09/03/2017;;;
09/03/2017;7000001229;INCLUSION INDICADOR REEMPAQUE VOCOLLECT ;WEB;SD-IS;CONTRALORIA;CEDI – REGIONALES;;INSAP CONSULTORIA ;GIOVNNI LOPEZ URBINA;CERRADO;16/03/2017;;;
09/03/2017;7000001230;CONDICIONES DE PLAZOS EN KIT VIRTUAL;WEB;SD-IS;COMERCIAL;VENTAS;;INSAP CONSULTORIA ;GIOVNNI LOPEZ URBINA;CERRADO;14/03/2017;;;
09/03/2017;7000001231;WA: CONDICIONES DE PLAZOS EN KIT VIRTUAL;WEB;SD-IS;COMERCIAL;VENTAS;;WAPLICACIONES;ALEJANDRO ARDILA;CERRADO;09/03/2017;;;
13/03/2017;7000001235;IN: CONTROL INVENTARIO DE CUBETA FASE 2;WEB;SD-IS;CONTRALORIA;CONTRALORIA;;INTERFACES;INTERFACES ;DESARROLLO CONSULTORIA;13/03/2017;;;Purebas y Ajustes INTERFACES
13/03/2017;7000001236;IN: CONTROL INVENTARIO DE CUBETAS FASE 3;SAP;SD-IS;CONTRALORIA;CONTRALORIA;;INTERFACES;INTERFACES ;DESARROLLO CONSULTORIA;13/03/2017;;;Purebas y Ajustes INTERFACES
13/03/2017;7000001237;WA: FORMULARIO PARA VALORACION DE DROGUERIA;WEB;SD-IS;DESARROLLO EMPRESARIAL;DESARROLLO EMPRESARIAL;;WAPLICACIONES;ALEJANDRO ARDILA;DESARROLLO CONSULTORIA;13/03/2017;;;Pendiente ajustes al requerimiento. Por desarrollo empresarial
14/03/2017;7000001238;REGISTROS DUPLICADOS EN BONIFICACIONES ;WEB;SD-IS;COMERCIAL;VENTAS;;INSAP CONSULTORIA ;GIOVNNI LOPEZ URBINA;CERRADO;21/03/2017;;;
16/03/2017;7000001239;WEB: ESTRUCTURA INTRANET COLABORADORES;SAP;SD-IS;GENERAL;COMUNICACIONES;;WAPLICACIONES;ALEJANDRO ARDILA;CERRADO ;21/03/2017;;;
21/03/2017;7000001240;IN: CORRECION PROGRAMA GESTION DE ALMACENES;SAP;MM-IS;CONTRALORIA;CONTRALORIA;;INTERFACES;INTERFACES;CERRADO;21/03/2017;;;
21/03/2017;7000001241;ACTUALIZACION NUMERACION FACTURACION;SAP - HANA – BO;FI-BL-IS;CONTRALORIA;IMPUESTOS;;;;CERRADO;23/03/2017;;;
22/03/2017;7000001242;CONCILICION FACTURA ;SAP;MM-IS;CONTRALORIA;CONTRALORIA;;JOSE MACIAS CHACON;JOSE MACIAS CHACON;PENDIENTE DEFINICION;22/03/2017;;;pendiente Definición de usuario - identificar los ajustes o redifiniciones que se necesiten aplicar / Usuario 26/06/2018 desde 19/10/2018
22/03/2017;7000001243;WA: INTEGRACION BO - PLAN ALIANZA – 7000001243;WEB;SD-IS;COMERCIAL;SOPORTE TECNOLOGICO;;WAPLICACIONES;ALEJANDRO ARDILA;CERRADO;23/03/2017;;;
23/03/2017;7000001244;REVISION TX: ZFIFACTOR_TNG;WEB;FI-BL-IS;GENERAL;COSTOS Y PRESUPUESTOS;;N2N BUSINESS SOLUTIONS S.A.S;JORGE QUIROGA;CERRADO;24/03/2017;;;
23/03/2017;7000001245;DETALLE KNAPP;SAP;MM-IS;COMERCIAL;SOPORTE TECNOLOGICO;NAZLY CHACON;INSAP CONSULTORIA ;GIOVNNI LOPEZ URBINA;CERRADO;24/03/2017;;;
24/03/2017;7000001246;ERROR ARCHIVO PLANO FACTURAS CONVENIOS;WEB;SD-IS;COMERCIAL;VENTAS;;N2N BUSINESS SOLUTIONS S.A.S;JORGE QUIROGA;CERRADO;30/03/2017;;;
24/03/2017;7000001247;HCM: ERROR CALCULO DIAS DE INCAPACIDAD;WEB;;ADMINISTRATIVA;GESTION HUMANA;;;;CERRADO;27/03/2017;;;
24/03/2017;7000001248;HCM:ERROR CALCULO VACACIONES COMPENSADAS;SAP;;ADMINISTRATIVA;GESTION HUMANA;;;;CERRADO;24/03/2017;;;
27/03/2017;7000001250;HCM:CORRECCIONES REDONDEO CASOS ESPECIAL;SAP;HCM;ADMINISTRATIVA;GESTION HUMANA;;HR SOLUTIONS;HR SOLUTIONS;CERRADO;30/03/2017;;;
29/03/2017;7000001251;NOMBRE DEL EVENTO EN PEDIDOS CON TRANSFERENCIAS INTEGRADAS;SAP;SD-IS;COMERCIAL;SOPORTE TECNOLOGICO;;INSAP CONSULTORIA ;GIOVNNI LOPEZ URBINA;CERRADO;31/03/2017;;;
29/03/2017;7000001252;MODIFICACION ZFI_CERAN CERTIFICADO ANUAL;WEB;FI-BL-IS;CONTRALORIA;CONTABILIDAD;PABLO MESA ;INSAP CONSULTORIA ;GIOVNNI LOPEZ URBINA;PRUEBAS QAS;31/10/2017;;;ajustes del requerimiento en QAS porque gerero error al Usuario / Giovanni 16/06/2018 desde el  16/05/2018 - se debe definir con impuestos algunos cambios 
30/03/2017;7000001253;AJUSTES MULTICHASH;WEB;FI-BL-IS;CONTRALORIA;CONTABILIDAD;;APM CONSULTING S.A.S.;ANGELA CARIDAD PIÑERO MORA;CERRADO;31/03/2017;;;
31/03/2017;7000001254;WA: AJUSTES PAGINA WEB - ABRIL 2017;WEB;SD-IS;COMERCIAL;SOPORTE TECNOLOGICO;;WAPLICACIONES;ALEJANDRO ARDILA;CERRADO;06/04/2017;;;
31/03/2017;7000001255;HCM: VISUALIZACIÓN LICENCIAS REMUNERADAS;SAP;HCM;ADMINISTRATIVA;GESTION HUMANA;;HR SOLUTIONS;HR SOLUTIONS;CERRADO;04/04/2017;;;
04/04/2017;7000001260;AJUSTES ARCHIVO PLANO POS - CONVENIOS;WEB;SD-IS;COMERCIAL;VENTAS;;N2N BUSINESS SOLUTIONS S.A.S;JORGE QUIROGA;CERRADO;07/04/2017;;;
07/04/2017;7000001261;REVISION CARTERA TERCEROS;WEB;FI-BL-IS;CONTRALORIA;CARTERA;;INSAP CONSULTORIA ;GIOVNNI LOPEZ URBINA;CERRADO;10/04/2017;;;
07/04/2017;7000001262;ERROR CANTIDADES DATO MAESTRO;WEB;SD-IS;COMERCIAL;SOPORTE TECNOLOGICO;;INSAP CONSULTORIA ;GIOVNNI LOPEZ URBINA;CERRADO;10/04/2017;;;
10/04/2017;7000001265;HCM: GENERAR INFORMACION PARA LA UGPP;SAP;HCM;ADMINISTRATIVA;GESTION HUMANA;;HR SOLUTIONS;HR SOLUTIONS;CERRADO;11/04/2017;;;
10/04/2017;7000001266;IN: AJUSTES GESTION DE ALMACENES FASE 2;WEB;SD-IS;CONTRALORIA;CONTRALORIA;;INTERFACES;INTERFACES;CERRADO;10/04/2017;;;
11/04/2017;7000001267;HCM_CREACION ENTIDADES EPS - 2017;SAP;HCM;ADMINISTRATIVA;GESTION HUMANA;;HR SOLUTIONS;HR SOLUTIONS;PRUEBAS QAS;18/04/2017;;;Ajustes del Consultor, Se realizaron las pruebas en QAS, el resultado No es satisfactorio, la entidad 900462447E FOSYGA no existe.
11/04/2017;7000001268;HCM: ERROR CALCULO NOMINA 1QN ABRIL 2017;SAP;HCM;ADMINISTRATIVA;GESTION HUMANA;;HR SOLUTIONS;HR SOLUTIONS;CERRADO;11/04/2017;;;
11/04/2017;7000001269;AJUSTES ARCHIVO PLANO SIP DESADV;WEB;SD-IS;COMERCIAL;VENTAS;;N2N BUSINESS SOLUTIONS S.A.S;JORGE QUIROGA;CERRADO;14/04/2017;;;
11/04/2017;7000001270;WA: REPORTE PRODUCTOS SIN INVENTARIOS;SAP;SD-IS;COMERCIAL;VENTAS;;WAPLICACIONES;ALEJANDRO ARDILA;CERRADO;17/04/2017;;;
17/04/2017;7000001275;TRASLADO MATERIAS PRIMAS DESARROLLO - TX 201;SAP;MM-IS;COMERCIAL;MARCAS PROPIAS;;JOSE MACIAS CHACON;JOSE MACIAS CHACON;CERRADO;19/04/2017;;;
17/04/2017;7000001276;EWM: PUNTOS CRITICOS;SAP;MM-IS;PROYECTO EWM;PROYECTO EWM;NAZLY CHACON;JOSE MACIAS CHACON;JOSE MACIAS CHACON;DESARROLLO CONSULTORIA;18/07/2017;;;
17/04/2017;7000001277;CREACIÓN MATERIAL PARA COBROS FARMACENTE;WEB;SD-IS;COMERCIAL;FARMACENTER;;ANA JIMENA RODAS;ANA JIMENA RODAS;CERRADO;19/04/2017;;;
17/04/2017;7000001278;EWM: FORMATOS E IMPRESIONES;SAP;MM-IS;PROYECTO EWM;PROYECTO EWM;MARIO CASTRO;;;DESARROLLO CONSULTORIA;18/07/2017;;;
19/04/2017;7000001279;WA: CONSECUTIVO TRANSFERENCIAS POSICION;SAP;SD-IS;COMERCIAL;VENTAS;;WAPLICACIONES;ALEJANDRO ARDILA;CERRADO;26/04/2017;;;
19/04/2017;7000001280;ASIGNAR CAMPOS EN MAESTRO DE CLIENTES;WEB;SD-IS;COMERCIAL;SOPORTE TECNOLOGICO;;ANA JIMENA RODAS;ANA JIMENA RODAS;CERRADO;25/04/2017;;;
20/04/2017;7000001281;INFORME GERENCIAL/TESORERIA – MULTICASH 7000001281 ;SAP;FI-BL-IS;CONTRALORIA;CONTABILIDAD;PABLO MESA ;APM CONSULTING S.A.S.;ANGELA CARIDAD PIÑERO MORA;PRUEBAS QAS;03/05/2017;;;"Pdt. Consultor, Manual para usuario
Pdt, Usuario, pruebas del req
"
24/04/2017;7000001285;WA: WEB SERVICE CUPOS SIP CONVENIOS;WEB;SD-IS;COMERCIAL;VENTAS;;WAPLICACIONES;ALEJANDRO ARDILA;CERRADO;28/02/2017;;;
25/04/2017;7000001286;HCM: CREACION CC LICENCIA REMUNERADA;SAP;HCM;ADMINISTRATIVA;GESTION HUMANA;;HR SOLUTIONS;HR SOLUTIONS;CERRADO;27/04/2017;;;
25/04/2017;7000001287;ERROR DESBLOQUEO PEDIDOS ENTREGA AUTOMATICO ;SAP;SD-IS;COMERCIAL;VENTAS;;ANA JIMENA RODAS;ANA JIMENA RODAS;CERRADO;01/06/2017;;;
26/04/2017;7000001288;MOTIVOS DE RECHAZO CODIGOS DE UTILIZACIO;WEB;SD-IS;COMERCIAL;SOPORTE TECNOLOGICO;;ANA JIMENA RODAS;ANA JIMENA RODAS;CERRADO;02/05/2017;;;
26/04/2017;7000001289;PLANO ESTADO DE CTA COLUMNA MORA;WEB;SD-IS;COMERCIAL;SOPORTE TECNOLOGICO;;INSAP CONSULTORIA ;GIOVNNI LOPEZ URBINA;CERRADO;07/04/2017;;;
26/04/2017;7000001290;HCM: AJUSTES MANUALES RETENCION  POR SALARIOS;;;ADMINISTRATIVA;GESTION HUMANA;SIN USUARIO;SIN EMPRESA;SIN CONSULTOR;ANULADO ;ANULADO;ANULADO;ANULADO;
27/04/2017;7000001291;CREACION CUENTA DE COBRO COSTOS;WEB;SD-IS;GENERAL;COSTOS Y PRESUPUESTOS;;ANA JIMENA RODAS;ANA JIMENA RODAS;CERRADO;02/05/2017;;;
28/04/2017;7000001292;ERROR VALES;SAP;SD-IS;COMERCIAL;VENTAS;;ANA JIMENA RODAS;ANA JIMENA RODAS;ANULADO;ANULADO;ANULADO;ANULADO;Anulado por que es reemplazado por el Req. 7000001287
02/05/2017;7000001295;WA: AJUSTES PAGINA WEB - MAYO - 2017;WEB;SD-IS;COMERCIAL;SOPORTE TECNOLOGICO;;WAPLICACIONES;ALEJANDRO ARDILA;CERRADO;02/05/2017;;;
02/05/2017;7000001296;BONIFICACION COMPARATIVO;WEB;SD-IS;COMERCIAL;SOPORTE TECNOLOGICO;;PROJECTION CORE;MIGUEL ESCOBAR;CERRADO;03/05/2017;;;
02/05/2017;7000001297;AJUSTE TEXTO - ZNNC - NOTA CREDITO;WEB;SD-IS;COMERCIAL;SOPORTE TECNOLOGICO;;ANA JIMENA RODAS;ANA JIMENA RODAS;CERRADO;02/05/2017;;;
02/05/2017;7000001298;HCM: CONTABILIZACION NOMINA;SAP;HCM;ADMINISTRATIVA;GESTION HUMANA;;HR SOLUTIONS;HR SOLUTIONS;CERRADO;04/05/2017;;;
02/05/2017;7000001299;HCM: NOTA INDEMNIZACION BONO RETIRO/PS;SAP;HCM;ADMINISTRATIVA;GESTION HUMANA;;HR SOLUTIONS;HR SOLUTIONS;CERRADO;02/05/2017;;;
03/05/2017;7000001300;MODIFIACION PROGRAMA TRANSFERENCIAS;WEB;SD-IS;COMERCIAL;SOPORTE TECNOLOGICO;;PROJECTION CORE;MIGUEL ESCOBAR;CERRADO;04/05/2017;;;
05/05/2017;7000001301;SALIDA READIOFRECUECIAS  AGIL;SAP;MM-IS;COMERCIAL;SOPORTE TECNOLOGICO;;INSAP CONSULTORIA ;GIOVNNI LOPEZ URBINA;CERRADO;05/05/2017;;;
05/05/2017;7000001302;AJUSTE PROG. ZCDSD_CORREOS_PLANILLAS;WEB;SD-IS;COMERCIAL;VENTAS;;N2N BUSINESS SOLUTIONS S.A.S;JORGE QUIROGA;CERRADO;09/05/2017;;;
09/05/2017;7000001305;MODIFICACION MOTIVOS DE RECHAZO;SAP;MM-IS;CONTRALORIA;CONTRALORIA;;INSAP CONSULTORIA ;GIOVNNI LOPEZ URBINA;CERRADO;10/05/2017;;;
09/05/2017;7000001306;PRESENTACION MODULO FINANCIERO TESORERIA;SAP;FI-BL-IS;CONTRALORIA;TESORERIA;SIN USUARIO;SIN EMPRESA;SIN CONSULTOR;ANULADO ;09/05/2017;ANULADO;ANULADO;
09/05/2017;7000001307;AJUSTE PROG. C/D LISTA PRECIO CONVENIOS;WEB;SD-IS;COMERCIAL;VENTAS;;N2N BUSINESS SOLUTIONS S.A.S;JORGE QUIROGA;CERRADO;10/05/2017;;;
10/05/2017;7000001308;WA: BUSQUEDA POR GRUPO SUBGRUPOS;SAP;SD-IS;GENERAL;COMUNICACIONES;;WAPLICACIONES;ALEJANDRO ARDILA;CERRADO;12/05/2017;;;
10/05/2017;7000001309;SOLICITUD CRUCE DE NOTAS PENDIENTES NTI;WEB;FI-BL-IS;NTI;CARTERA – NTI;;APM CONSULTING S.A.S.;ANGELA CARIDAD PIÑERO MORA;CERRADO;11/05/2017;;;
11/05/2017;7000001310;NUEVOS AJUSTES ARCHIVO PLANO SIP DESADV;WEB;SD-IS;COMERCIAL;VENTAS;;N2N BUSINESS SOLUTIONS S.A.S;JORGE QUIROGA;CERRADO;12/05/2017;;;
12/05/2017;7000001311;REPORTE BO - SEMANAS FERIALES;WEB;SD-IS;PROYECTO BO;PROYECTO BO;;CONSULTORIA ORGANIZACIONAL ;JORGE AYLLON;CERRADO;15/05/2017;;;
12/05/2017;7000001312;REP- COMPRAS LIQUIDACION DECLARACION IVA;SAP;FI-BL-IS;CONTRALORIA;IMPUESTOS;;PROJECTION CORE;MIGUEL ESCOBAR;CERRADO;26/07/2017;;;
12/05/2017;7000001313;REP-GENER INFORMACION MEDIOS MANEGTICOS;SAP;FI-BL-IS;CONTRALORIA;IMPUESTOS;;APM CONSULTING S.A.S.;ANGELA CARIDAD PIÑERO MORA;CERRADO;;;;
12/05/2017;7000001314;CLASIFIC. CARTERA RECAUDOS Y DESCUENTOS;SAP;FI-BL-IS;GENERAL;COSTOS Y PRESUPUESTOS;MARISOL ARIAS;N2N BUSINESS SOLUTIONS S.A.S;HANSEL DAVID ESPINOZA;PRUEBAS QAS;14/01/2018;;;Pruebas en QAS del Usuario
12/05/2017;7000001315;MODIFICACION CARGUE MULTICHASH 4 POR MIL;SAP;FI-BL-IS;CONTRALORIA;CONTABILIDAD;;APM CONSULTING S.A.S.;ANGELA CARIDAD PIÑERO MORA;CERRADO;16/05/2017;;;
16/05/2017;7000001320;RECEPCION DE INFORM. TRAZAMED RFID BELLO;SAP;MM-IS;PROYECTO RFID;PROYECTO RFID;;INSAP CONSULTORIA ;GIOVNNI LOPEZ URBINA;CERRADO;16/05/2017;;;
16/05/2017;7000001321;CONSULTA SAP - FACTURA ELECTRONICA;WEB;SD-IS;COMERCIAL;SOPORTE TECNOLOGICO;;ANA JIMENA RODAS;ANA JIMENA RODAS;CERRADO;22/05/2017;;;
18/05/2017;7000001322;ERROR DESCUENTO AVISO DE TRASLADO;WEB;FI-BL-IS;CONTRALORIA;TESORERIA;;INSAP CONSULTORIA ;GIOVNNI LOPEZ URBINA;CERRADO;23/05/2017;;;
23/05/2017;7000001325;REVISION PARAMETRIZACION - NOMINA ;WEB;FI-BL-IS;CONTRALORIA;CONTABILIDAD;;APM CONSULTING S.A.S.;ANGELA CARIDAD PIÑERO MORA;CERRADO;31/05/2017;;;
25/05/2017;7000001326;WA: AJUSTE BOTONES SIP;;SD-IS;COMERCIAL;SOPORTE TECNOLOGICO;;WAPLICACIONES;ALEJANDRO ARDILA;CERRADO;25/05/2017;;;
31/05/2017;7000001330;CREACION DE CLASES;SAP;FI-BL-IS;CONTRALORIA;CONTABILIDAD;;APM CONSULTING S.A.S.;ANGELA CARIDAD PIÑERO MORA;CERRADO;01/06/2017;;;
01/06/2017;7000001331;WA: AJUSTES PAGINA WEB - JUNIO - 2017;WEB;SD-IS;COMERCIAL;SOPORTE TECNOLOGICO;;WAPLICACIONES;ALEJANDRO ARDILA;CERRADO;01/06/2017;;;
01/06/2017;7000001332;EWM: TALLERES - CAPACITACIONES;SAP;MM-IS;PROYECTO EWM;PROYECTO EWM;;ANA JIMENA RODAS;ANA JIMENA RODAS;DESARROLLO CONSULTORIA;07/06/2017;;;
01/06/2017;7000001333;WA: ESTRUCTURA INTRANET COLABORADORES;WEB;SD-IS;GENERAL;COMUNICACIONES;;WAPLICACIONES;ALEJANDRO ARDILA;CERRADO;06/06/2017;;;
01/06/2017;7000001334;IN:AULA VIRTUAL FUNCIONARIOS COOPIDROGAS;WEB;SD-IS;ADMINISTRATIVA;ORGANIZACIÓN Y METODOS;;INTERFACES;INTERFACES ;DESARROLLO CONSULTORIA;01/06/2017;;;PRD Capacitación usuario
01/06/2017;7000001335;HCM: CREACION CENTRO DE COSTO 8010102;SAP;HCM;ADMINISTRATIVA;GESTION HUMANA;YULY JIMENEZ;HR SOLUTIONS;HR SOLUTIONS;CERRADO;01/06/2017;;;
06/06/2017;7000001340;HCM: MODIF-DESARROLLO DESPRENDIBLE;SAP;HCM;ADMINISTRATIVA;GESTION HUMANA;;HR SOLUTIONS;HR SOLUTIONS;CERRADO;08/06/2017;;;
07/06/2017;7000001341;WA: PLANOS POS FASE 2;WEB;SD-IS;COMERCIAL;VENTAS;;WAPLICACIONES;ALEJANDRO ARDILA;CERRADO;09/06/2017;;;
08/06/2017;7000001342;ASIGNACION DE RUTAS ARCHIVOS VOCOLLECT;SAP;MM-IS;CONTRALORIA;CEDI – REGIONALES;OSCAR CLAVIJO;INSAP CONSULTORIA ;GIOVNNI LOPEZ URBINA;PRUEBAS QAS;08/06/2017;;;Ajustes QAS Consultor fue probado cómo se evidencia en el formato anexo, presentando una novedad para la asignación de la ruta y datos de Muelle e indicador de reempaque para el tipo de pedido ZVAL.
09/06/2017;7000001343;HCM: CREACION CC-NOMINAS PARA LIBRANZAS;SAP;HCM;ADMINISTRATIVA;GESTION HUMANA;;HR SOLUTIONS;HR SOLUTIONS;CERRADO;13/06/2017;;;
09/06/2017;7000001344;HCM: ERROR CALCULO NOMINA 1QN JUNIO 2017;SAP;HCM;ADMINISTRATIVA;GESTION HUMANA;;HR SOLUTIONS;HR SOLUTIONS;CERRADO;13/06/2017;;;
12/06/2017;7000001345;PLANO SIP PRODRUCTOS ENTREGA AL CLIENTE;WEB;SD-IS;COMERCIAL;VENTAS;;INSAP CONSULTORIA ;GIOVNNI LOPEZ URBINA;CERRADO;14/06/2017;;;
13/06/2017;7000001346;TARJETAS BONO REGALO - FARMACENTER;WEB;FI-BL-IS;CONTRALORIA;TESORERIA;;PROJECTION CORE;MIGUEL ESCOBAR;CERRADO;20/06/2017;;;
14/06/2017;7000001347;HCM: NOTAS RELEVANTES CALCULO NOMINA;;;ADMINISTRATIVA;GESTION HUMANA;;;;CERRADO;27/06/2017;;;
20/06/2017;7000001350;BLOQUEO GENERAR DOC. CLIENTES RETIRADOS;;SD-IS;COMERCIAL;SOPORTE TECNOLOGICO;;ANA JIMENA RODAS;ANA JIMENA RODAS;CERRADO;27/06/2017;;;
22/06/2017;7000001351;HCM: CONTRAPARTIDA ALIMENTACION - BELLO;SAP;HCM;ADMINISTRATIVA;GESTION HUMANA;;HR SOLUTIONS;HR SOLUTIONS;CERRADO;27/06/2017;;;
